season,episode,speaker,line
3,27,Lawrence,"Goodbye boys, have a great day, I'm off to work."
3,27,Phineas,"Goodbye dad, have fun buying from auctions and private sales performing minor refurbishments to the purchase items, marking up the price and then selling them to your customers!"
3,27,Ferb,(To the camera) Our dad sells antiques.
3,27,Phineas,"You know Ferb, it's strange how we wave our hands when we say goodbye. It seems so arbitrary. Why don't people jump up and down or stick out their tongues, or slap their thighs?"
3,27,Phineas,"Well, if by that you mean we should create a whole new form of communication, then I couldn't agree more! That was some nice gesturing, Ferb. Do some more!"
3,27,Phineas,"Ah. I...know...what...we're...going...to do...spatula! Oh, today...I really should have known that from the context."
3,27,Phineas,"Oh, here's another one! Hey...where's...spatula! Oh, context again..."
3,27,Major Monogram,"Ah Agent P. Sorry I'm running a little late this morning. Our satellites haven't picked up any Inator activity coming from Doofenshmirtz, but that's no indication that he isn't up to something. We want you to get down there and have a little look-see. Good hunting Agent P."
3,27,Phineas,"Finally when someone sneezes rather than say gesundheit, just play flugelhorn and give him your left shoe. I think we nailed down the non-verbal cues. Now let's look at the syntax!"
3,27,Linda,"Candace? What's wrong, honey?"
3,27,Candace,"Mom, they're doing stuff out there!"
3,27,Linda,"(looks at the boys) Candace, they're just writing on a whiteboard."
3,27,Candace,"Yes, that's it, they're plotting. And you know what that leads to. Implementing-guh!"
3,27,Linda,"Candace, you need to lighten up a little. Take it easy. Do you know what I do to relax?"
3,27,Candace,You eat some pie and then laid down on that old sensory deprivation tank we keep in the basement.
3,27,Linda,That's right! Would you like to try it?
3,27,Candace,"Um, I'm gonna go with no, but thank you."
3,27,Linda,Well you should still try to relax.
3,27,Candace,"Mom, I don't need to relax, I need to bust Phineas and Ferb."
3,27,Linda,"Well listen sweetie, you said so yourself, they're just plotting, right? That gives you plenty of time to go to the mall before they start implementing-guh. (makes hand gestures)"
3,27,Candace,"Yeah, that makes a lot of sense! Maybe—Hey, wait a second, are you making fun of me?"
3,27,Linda,Maybe just a little. (leaves)
3,27,Candace,"She's right, I probably have plenty of time to go to the mall!"
3,27,Phineas,"Okay, Ferb, let's start implementing!"
3,27,Doofenshmirtz,"(adjusting something on Norm's back) Just one more bolt right behind- (Perry♪) So, Perry the Platypus, we meet again! But this time, the advantage is mine... (to Norm) Hey, what are you waiting for Norm, we rehearsed this like a thousand times! I say ""Ah, Perry the Platypus, we meet again, only this time the advantage is mine"", you go and get him!"
3,27,Norm,Going and getting!
3,27,Doofenshmirtz,"(writing) Note to self, say the --- for replacing Norm's head. (Norm captures Perry in a bag) Okay, much better (to Perry) this is a good look for you!"
3,27,Isabella,Hi guys. Whatcha doin'?
3,27,Phineas,Erb-Ferb Atin-Lerb!
3,27,Isabella,"Oh, creating a whole new form of communication today, are we?"
3,27,Phineas,"Yeah, what do you think?"
3,27,Isabella,Sounds fun! What do you call it?
3,27,Phineas,"Ferb Latin! Where you take the first letter of every word, move it to the end, and then you say erb! So Ferb becomes erb-ferb, and Latin becomes atin-lerb! Two letter words stay the same, like or stays or. All the fun of Pig Latin, and it's safe for vegetarians to use!"
3,27,Isabella,"Oh, Phineas, I think your new language is onderful-werb!"
3,27,Phineas,"By Jove, I think she's got it! But there's also a lot of non-verbal cues! For example, if you wanna say okay, you reach for the sky!"
3,27,Buford,"Yeah! And when you're hungry, you crack your knuckles! (cracks knuckles) Oh, baby, that's good..."
3,27,Phineas,"And if you smell something bad, you do jazz hands!"
3,27,Baljeet,"(to Buford) Stop looking at me, I'm not going to do jazz hands! Even though you have totally earned it..."
3,27,Isabella,How do you say goodbye?
3,27,Phineas,"When you say goodbye, you blow a raspberry! (blows a raspberry) Let's all do it!"
3,27,Doofenshmirtz,"I bet you're wondering where my Inator is, right? C'mon, guess? Guess, no? No? Can I get a play-Oh alright ergh alright. Don't play. It's Norm!"
3,27,Norm,Let's hope there's no self-destruct button on this one!
3,27,Doofenshmirtz,"You've always had one, Norm. I just never told you where it was so you wouldn't pick at it!"
3,27,Doofenshmirtz,"And stop interrupting me! Anyway, I've done a lot of research for the past... you know, few hours... and I, and I found that most people will believe anything they read! And I know it's true, 'cause you know... I read it online somewhere. So, my new weapon to take over the Tri-State Area is... propaganda!"
3,27,Norm,Propaganda consists of messages that dishonestly attempt to influence the attitude of a community!
3,27,Doofenshmirtz,"Thanks for that, Mr. Norm-It-All. I've installed a switch back here that prints out propaganda leaflets. All I have to do is speak my evil messages into this microphone, err let's see... eh, ""slap yourself""! Push this button and, whatever I say (presses button and leaflet comes out) comes printed out on a leaflet. It's gonna work! I'm using a very convincing font. It's bold and it has a lot of serifs!"
3,27,Norm,Serifs are semi-structural details that...
3,27,Doofenshmirtz,"(cuts off Norm) Oh, for crying out loud, Norm! Listen, here's a buck, why don't you go get out of here and get a haircut or something!"
3,27,Norm,Out I go! (Going with Perry still in hand)
3,27,Doofenshmirtz,"Uh, Norm, take the dollar and leave the platypus.(He hands Norm the dollar, who puts Perry on the floor then walks out right through the wall) And when you come back use the door! (to Perry) He gets that from you, you know. Anyway, my plan is to fly Norm all over the Tri-State Area and drop leaflets, then everyone will do my bidding!"
3,27,Doofenshmirtz,"Man, that really is a convincing font."
3,27,Ice cream guy,"Hi, kids, what'll it be?"
3,27,Phineas,Ocolate-Cherb.
3,27,Isabella,Awberry-Strerb.
3,27,Baljeet,Anilla-Verb.
3,27,Buford,Emon-Lerb.
3,27,Ferb,Erry-Cherb.
3,27,Ice cream guy,Are you kids from outta town?
3,27,Phineas,"No no no, we're speaking Ferb Latin! You move the first letter to the end of the word then add erb! One and two letter words stay the same."
3,27,Ice cream guy,"Oh, I get it! Ocolate-Cherb is chocolate, and anilla-verb is vanilla!"
3,27,Random Woman,"Ooh, at's-therb ute-cerb."
3,27,Random Woman,Did..that mean goodbye?
3,27,Ice cream guy,I'm gonna borrow it.
3,27,Woman,Are you having trouble relaxing?
3,27,Candace,A little...
3,27,Woman,Try our new liquid massage. This isn't your mother's sensory deprivation tank. A few minutes in here will change your world!
3,27,Candace,"Alright, strap me in!"
3,27,Barber 1,Ice-nerb adge-berb.
3,27,Customer,Es-yerb it is.
3,27,Norm,"Hey, what's that language they're speaking?"
3,27,Barber 2,That is Ferb Latin!
3,27,Norm,I like it! And intend to use it whenever I can. Tell me how it works.
3,27,News-anchor,"Hey, I hear you kids have invented a new language. Tell us all about it!"
3,27,Phineas,"Sure, follow me!"
3,27,(Song,"""Ferb Latin"")"
3,27,Phineas,♪ You take the first letter of every word ♪
3,27,Isabella,"♪ Whenever someone sneezes, ♪"
3,27,"Phineas, Isabella",♪ Whenever you meet someone on the street ♪
3,27,Isabella,♪ You take the first letter of every word ♪
3,27,Phineas,"♪ Whenever someone sneezes, ♪"
3,27,"Phineas, Ferb, Isabella, Baljeet, Buford",♪ So those are the rules and we hope you enjoy them ♪
3,27,Isabella,♪ You take the first letter of every word ♪
3,27,Phineas,"♪ Whenever someone sneezes, ♪"
3,27,"Baljeet, Buford",♪ Whenever you meet someone on the street ♪
3,27,(Note,Lines in blue are sung simultaneously.)
3,27,Norm,(Norm uses the door but smashes through the door and causes damage to the walls) I'm ack-berb!
3,27,Doofenshmirtz,"(Annoyed that Norm still caused damage using the door) Oh, great. Nice haircut, by the way. Where's my change?"
3,27,Doofenshmirtz,"You're a weird robot, Norm."
3,27,Norm,Ank-therb ou-yerb!
3,27,Doofenshmirtz,"What is that, Swedish? You better not be broken, Norm. You still need to fly around the city distributing leaflets."
3,27,Doofenshmirtz,Well as long as you still remember the code for take-off...
3,27,Norm,Aunch-lerb?
3,27,Doofenshmirtz,"No, it's not ""aunch-lerb"", talk normal. It's launch, launch!"
3,27,Doofenshmirtz,"NO, WAIT NOT YET! AAAAH!"
3,27,Candace,"Hmm, I must have fallen asleep... Wow, am I relaxed...I wonder how long I was out?"
3,27,Candace,"Excuse me, what time is it?"
3,27,Woman,Ee-threrb enty-twerb.
3,27,Candace,"Uh, what?"
3,27,Woman,Ee-threrb enty-twerb.
3,27,Candace,My ears must be over-relaxed.
3,27,Candace,What? (reading street sign) Ain-merb reet-sterb?
3,27,Man,Cuse-exerb e-merb?
3,27,Candace,Excuse me?
3,27,Man,Ublic-perb estroom-rerb?
3,27,Candace,"I'm sorry, I no speak-erb your lang-werb..."
3,27,Man,Azz-jerb ands-herb? I ell-smerb?
3,27,Candace,What is happening here? All I did was go like (does jazz hands)
3,27,Candace,What is this? I am losing it!
3,27,News-anchor,(on TV) And how did this latest cultural craze get started? We talked to the creators.
3,27,Candace,This whole town has gone crazy!
3,27,Phineas,"(on TV) Ferb Latin isn't just a language, it's a way of life!"
3,27,Candace,Ferb Latin? I should have known Phineas and Ferb were behind this! (to the boys on TV) You are so usted-berb!
3,27,Linda,"What is it Candace? (Candace asks something) No, I don't know what Ferb Latin is. (sighs) Give me fifteen minutes."
3,27,Lawrence,"(from inside the tank) Uh, dear, as long as you're getting up, could you get me some more pie?"
3,27,Doofenshmirtz,"Not yet, you hunk of junk! (sees Perry unloading Norm's fuel) Perry the Platypus, how did you get- (Perry jumps off and opens his parachute) Curse you, Perry the Platypus!!"
3,27,Norm,We're oing-gerb own-derb!
3,27,Doofenshmirtz,"Knock it off with the babble talk, I can't stand it! (Doofenshmirtz stomps down several times on the button) TALK NORMAL!"
3,27,Man,"(reading the leaflet) ""Talk normal"". Huh."
3,27,Woman,"Yeah, okay, I'm convinced."
3,27,Candace,"Mom mom mom! Come with me. Phineas and Ferb created a new language and everybody's speaking it, and now we can't understand anybody! Watch this! What time is it?"
3,27,Woman,Twenty minutes since the last time you asked me.
3,27,Candace,What? You there! Talk!
3,27,Man,I don't think we have anything to say to each other! Not after the... jazz hands!
3,27,Linda,"Wow, he must really hate jazz hands."
3,27,Candace,I don't get it! Everybody was blowing raspberries and speaking this crazy language!
3,27,Linda,Look who's here.
3,27,Candace,"PHINEAS AND FERB! Alright, you two, what do you have to say for yourself?"
3,27,Phineas,"Look at that! Now, that's a convincing font."
3,27,Candace,Mom...they...I mean...em...
3,27,Linda,You remember that whole stress relief thing I mentioned earlier? You might wanna look into that.
3,27,Doofenshmirtz,"Well, that could've gone better."
3,27,Doofenshmirtz,"Not funny, Norm."
3,27,News-anchor,"Hey, I hear you kids have invented a new language. Tell us all about it!"
3,27,Phineas,"Sure, follow me!"
3,27,(Song,"""Ferb Latin"")"
3,27,Phineas,♪ You take the first letter of every word ♪
3,27,Isabella,♪ You take the first letter of every word ♪
3,27,Phineas,"♪ Whenever someone sneezes, ♪"
3,27,"Baljeet, Buford",♪ Whenever you meet someone on the street ♪
3,27,(Note,Lines in blue are sung simultaneously.)
3,33,Candace,"Oooooh! Here he comes! Oh, Jeremy. How can you even make walking to a bus stop cute? Yeah, I'm a lucky, lucky gal. (a strange object falls from Jeremy's backpack) Oh, no! He dropped something! Jeremy! Jeremy! (runs outside) Jeremy, wait! You dropped-- (bus leaves) wait! (calls Jeremy on her cellphone) Jeremy, you dropped something outside my house, and it kind of looks, uh, artsy."
3,33,Jeremy,Sounds like the gift I made you.
3,33,Candace,Gift? Well you didn't have to make--
3,33,Jeremy,Well we're passing the antenna farm. I'm losing you.
3,33,Woman,My fillings are heating up.
3,33,Candace,"Jeremy? Jeremy? (groans) Oh, what a beautiful tiara... neck, uh, broach... hmm... bracelet! (gasps) Oh, it's absolutely beautiful! (flings it into the sewer) Oops! No! No! No! No! (reaches for the object) Almost got it... (water rushes in and carries the object away)"
3,33,Man 1,Whoohoo! The Danville clean water flush-off!
3,33,Man 2,A million gallons straight to the ocean!
3,33,Candace,"Oh, you've got to be kidding me! Jeremy will be heartbroken when he finds out I lost my gift! Phineas and Ferb! (runs into the backyard) Hey. What are you guys doing?"
3,33,Phineas,We built a mind machine to enter Baljeet's subconscious in order to cure his fear of contractions.
3,33,Baljeet,You are amputating two perfectly good words and stitching them together. They are the Frankenstein monsters of grammar.
3,33,Phineas,We've already cured Irving's fear of the color lavender.
3,33,Irving,It can't hurt me anymore.
3,33,Candace,"Yeah, yeah, yeah. I don't care about any of that! I lost the gift Jeremy made for me, and you guys have to make an exact duplicate of it before he comes over!"
3,33,Phineas,We'd love to. What'd it look like?
3,33,Candace,"Well it kind of had this bolty screwy thing going on, and this wrapped wire like... Oh, I know what it looked like, but I don't know how to describe it!"
3,33,Phineas,"No problem. We can use the mind machine to enter your subconscious and retrieve your memory of what the gift looked like. You don't mind if we fix Candace's problem first, do you, Baljeet?"
3,33,Baljeet,"No, I don't (shudders) Chills! Chills! Hey where's (shudders) where is Perry?"
3,33,Doofenshmirtz,"♪ Eating cereal looks like this! ♪ (Perry enters the building) Ah! Perry the Platypus! You're early, and I'm in my underwear. So embarrassing. And it's the pair of underwear you never want anyone to see you in too. You know the ones. They're faded and frayed, and the elastic is so worn out you have to hold them up while you're  walking around the house. And you have to roll up the waist band, making your pants look all lumpy. And, and yet when you take them off, you find yourself mysteriously putting them in the hamper rather than the garbage. Why- why do you do that? Hey, where are you going Perry the Platypus?! (traps Perry in a net) You know, when you showed up, despite appearances, I was trying to come up with a perfect evil plan to thwart today's Tri-State Area Summit and Weenie Roast, and you just gave me a great idea! What is a man most afraid of? It's being in public and suddenly realizing he's in his underwear! So, I shall construct an Underwear-inator! One blast at the summit, and everyone will be so paralyzed with fear and embarrassment, I can just waltz in and take over. Thank you, Perry the Platypus. Thank you very much!"
3,33,Phineas,"Alright, Candace. You're all wired up. We're ready to go in."
3,33,Candace,Wait a minute. Why is that dweeb going into my subconscious?
3,33,Baljeet,Because this dweeb spent two weeks in psychology camp last summer.
3,33,All,How does that make you feel?
3,33,Candace,"Alright, but don't forget about doctor-patient confidentiality."
3,33,Phineas,"Okay, Irving. We're in your hands now."
3,33,Irving,Close your eyes and count backwards from four.
3,33,All,Three...two...one...
3,33,Candace,Where are we?
3,33,Phineas,We're inside your subconscious.
3,33,Candace,"Okay, everyone take off your shoes. I don't want you tracking mud in here, metaphorically speaking."
3,33,Irving,Mindmaster calling Deep Divers. How you guys doing?
3,33,Phineas,"We're doing fine, Irving."
3,33,Irving,"Remember, you have 45 minutes to retrieve the memory before the boyfriend arrives."
3,33,Phineas,"Copy that, Mindmaster. We need to get to the Forest of Memory."
3,33,Candace,So where are we now?
3,33,Phineas,"Offhand, I'd say the Jeremy Mountains."
3,33,Baljeet,"Hmm, significant."
3,33,Candace,"Uh, what was that?"
3,33,Phineas,Baljeet?
3,33,Baljeet,Shh! Do not move a muscle.
3,33,Candace,What is it?
3,33,Baljeet,It is your id.
3,33,Candace,My what?
3,33,Baljeet,"Your id. The embodiment of your deepest, most primal urges."
3,33,Candace,"So, fun, right?"
3,33,Baljeet,"Wrong. It is very primitive and aggressive. We do not want to meet it here. (shows gazelles that look like Phineas and Ferb running away from the id) Obviously, you see Phineas and Ferb as some sort of prey."
3,33,Candace,Run!
3,33,Doofenshmirtz,"Almost ready, Perry the Platypus, just a few more adjustments. I'm putting an extra ratty setting on the Underwear-inator. So embarrassing! (Perry takes a contact lenses out of his eye and holds it up to the light and tries to cut through the net)"
3,33,Irving,"Calling Phineas and Ferb. Come in, Phineas and Ferb. What's your 20?"
3,33,Phineas,"We copy you, Irving. We're just emerging from the Peaks and Valleys of Fickleness."
3,33,Candace,I have mixed feelings about it.
3,33,Phineas,"Wow, the Falls of Anxiety."
3,33,Falls of Anxiety,Is my neck to long? Is it okay that I wear the same dress everyday? (The falls continues to voice Candace's anxieties)
3,33,Candace,What's that?
3,33,Baljeet,It is all of Candace's anxieties.
3,33,Phineas,There are so... many of them.
3,33,Ferb,She has a rich internal life.
3,33,Buford,"Yeah, she's real messed up."
3,33,Candace,Buford?!
3,33,Isabella,What's he doin'?
3,33,Irving,He just showed up and jacked in!
3,33,Candace,You can't come in here!
3,33,Buford,It's a free country.
3,33,Candace,"No it's not! It's my head! And you're getting crumbs all over-- cru... all over... cru, cru, cru--"
3,33,Buford,What's wrong with her?
3,33,Baljeet,The anxieties are getting to her!
3,33,Phineas,"Hurry, everyone! Through the falls! The Palms of Sweatiness!"
3,33,Baljeet,The Harpies of Hyperventilation!
3,33,Candace,Rubber ducks?
3,33,Baljeet,Do not ask me! It is your subconscious!
3,33,Buford,"Yeah, I'll catch yous later. I'm keeping my hoagie dry."
3,33,Isabella,"Hey, Buford."
3,33,Buford,"Hey, Isabella. You just get here?"
3,33,Isabella,Yep.
3,33,Buford,Let me show you around. This place is a riot!
3,33,Doofenshmirtz,"(sniffs) Do you smell something burning? What are you doing?! Give me that! Got it! What is this, a tiny magnifying glass? Oh, you think you're so fancy with your high-tech spy equipment. (He crushes contact lenses) What are you going to do now? Huh, Perry the Platypus? Huh? (laughs) (Perry takes out the other contact lenses)"
3,33,(Song,Deep Into Your Mind)
3,33,Phineas,"Here we are Candace, the Forest of Memory."
3,33,Candace,How will we find Jeremy's gift?
3,33,Phineas,"Well, we shouldn't have to walk too far since it's a recent memory. What's the last thing you remember?"
3,33,Candace,"Hmm... the last thing I remember is saying, ""How will we find Jeremy's gift?"""
3,33,Phineas,Well we shouldn't have to walk too far since it's a recent memory. What's the last thing you remember?
3,33,Candace,"Oh, I forgot it already."
3,33,Phineas,No problem. This should be deep enough. Everybody just feel around. Maybe we can stimulate Candace's memory.
3,33,Candace,"That makes my head all buzzy. Wait, wait a minute, wait! I'm remembering! Yes, yes, I see it! Over there, through the trees! That's it!"
3,33,Jeremy,That's what?
3,33,Candace,"Jeremy? Wait, are you real?"
3,33,Jeremy,Yeah. I stopped by your house to give your present and Irving just told me to jack right in.
3,33,Candace,My present? How could you? I lost it. But I found the memory. It's right over there.
3,33,Jeremy,That? That's not your present. That's my drain unclogger. I don't know why I carry that around with me.
3,33,Candace,So I didn't lose your-- (id comes in and roars)
3,33,Baljeet,That is the id! Run!
3,33,Buford,"And if you follow me now, you'll see Candace's recurring nightmares. Come on, people. Try and stay with the group. (they see everyone running from the id) Hey, where are they going? (he sees the id and screams)"
3,33,Doofenshmirtz,"(as Perry escapes from the trap) Ironic, I built my Underwear-inator while actually in my underwear. Ha! (Perry attacks him and the Underwear-inator fires up)"
3,33,Id,(as children are running away from it) Clubby Momo!
3,33,Buford,"You all signed the releases, right?"
3,33,Id,Phineas and Ferb!
3,33,Doofenshmirtz,Ow! (Underwear-inator hits Perry) Ha! You look ridic-- (Underwear-inator hits Doofenshmirtz) Ah! Moth holes?!
3,33,Norm,Who wants lobster bisque? (Underwear-inator hits him) Get it while it's hot! (Perry disassembles the Underwear-inator)
3,33,Phineas,Irving! Get us out of here now!
3,33,Irving,"Roger, over! (Underwear-inator hits him) Ahh! Lavender! Ahh! It had to be lavender!"
3,33,Phineas,Hello? Irving? Hello?
3,33,Doofenshmirtz,"(as Perry is disassembling the Underwear-inator) Curse you, Perry the Platypus! You know, those, those really work for you."
3,33,Baljeet,I cannot believe I turned down a trip to the community pool for this!
3,33,Candace,She's growing! What do we do?
3,33,Phineas,One of us has to wake up and extract the others!
3,33,Baljeet,"I am trying to wake up, but I can't! Ahh! Oh! I feel a shock!"
3,33,Phineas,That's it! Let's all shock Baljeet awake with contractions!
3,33,Candace,Isn't!
3,33,Isabella,Won't!
3,33,Phineas,It's! Don't!
3,33,Isabella,Hasn't!
3,33,All,Ain't!
3,33,Baljeet,Ahh! That is both a contraction and grammatically incorrect! Ahh! (he wakes up)
3,33,Irving,(running around in circles) Lavender! Had to be lavender!
3,33,Baljeet,The... wires... must... pull... them... out... with... no muscles.
3,33,Candace,I don't think I can run anymore!
3,33,Phineas,Don't give up! Baljeet will save us!
3,33,Isabella,"I'm getting tired, too!"
3,33,Ginger,That's it! I'm dead meat!
3,33,Gretchen,"Gretchen is out! Peace! (Candace falls, causing everyone else to fall)"
3,33,Candace,I'm really complicated and weird. (everyone gets eaten by the id and wakes up)
3,33,Ginger,That was great! Let's do it again!
3,33,Irving,Not me!
3,33,Isabella,I wish I had my camera!
3,33,Baljeet,Wait until they hear about this at psychology camp!
3,33,Phineas,Goodbye everybody!
3,33,Candace,"Wow, I guess that was a lot of trouble to go through for a drain unclogger."
3,33,Jeremy,"Yeah, by the way, here's your real gift. (hands Candace a bracelet)"
3,33,Candace,"Jeremy, it's beautiful! I really love it. Thank you. Wait, hold on. Where's Buford?"
3,33,Buford,(to id) I don't care what Freud said about your selfish need for satisfaction. You're alright with me.
3,1,Phineas,"(offscreen) Hey, Ferb. What'cha wanna do today?"
3,1,Phineas,"(offscreen) Oops! (his hand comes in to pick it up.) It's way to nice out to be lying down. (Zoom out; they are in the living room, it is raining outside.) At least...in here, it is."
3,1,Phineas,Come in!
3,1,Isabella,(Sad voice) Hey Phineas. What'cha doin'?
3,1,Phineas,"Oh, what's the matter?"
3,1,Isabella,"(Sighs) We were going to go for our desert trekking patch today, but now it's raining."
3,1,Phineas,"Ferb, I know what we're gonna do today!"
3,1,Candace,"You see, I know Jeremy likes me, but I don't know why he likes me. And if I find out what it is that he likes about me, I can make sure I don't change that about myself. Because what if I stop doing whatever he likes? And then he stops liking me because I'm not doing it anymore?"
3,1,Linda,"Well, maybe he just likes hearing you talk."
3,1,Candace,Huh?
3,1,Linda,"Hey, where's Perry?"
3,1,Major Monogram,It's not like Agent P to miss...
3,1,Carl,"Right away, sir! (Presses play on the remote control and Perry slides on the video)"
3,1,Major Monogram,(Laughs)
3,1,Carl,"(Presses the slow motion button and Perry is in slow motion) Look sir, it's even funnier this way!"
3,1,Major Monogram,"(Laughs) Stop it, stop it. My cheeks hurt."
3,1,Major Monogram,"Oh uh... (Clears throat) Grow up, Carl!"
3,1,Major Monogram,"Anyhow, as you probably noticed there's been an unusual amount of rain in the Tri-State Area. Call us crazy, but we're thinking Doofenshmirtz! Investigate, and stop him at all costs. Well, maybe at a reasonable cost. We, I mean, we don't want to blow the whole budget on this one scheme, do we?"
3,1,Carl,"Run it again, sir?"
3,1,Major Monogram,I'll get the popcorn!
3,1,Isabella,"Wow, that was fast!"
3,1,Phineas,"Well, nobody likes working in the rain. Let's get dry, ladies! (As Phineas, Ferb, and the Fireside Girls enter the bio-dome) This biosphere can simulate almost any environment. (Ferb pulls a lever, sand begins pouring out of the ceiling, a fake sun shines and the tiles on the inside of the biosphere turn sky blue.) Can we cook or can't we?"
3,1,Isabella,"You guys are the greatest! Okay, according to the Fireside Girl handbook, we can find water in cacti."
3,1,Jeremy,"Hi, Candace. What do you say to a little picnic? You know, indoors."
3,1,Candace,Neat!
3,1,Jeremy,"We can't let a little rain put a damper on our-- wow! (Sees the biosphere, and Candace panics) I guess your brothers have been busy, huh? Oh, we should have our picnic in there!"
