season,episode,speaker,line
4,27,Candace,"(on phone) I'm totally sunk, Stace! I've been working on Jeremy's birthday present for months, but it's not even close to as good as I want it to be. (Cut to reveal she's working on a popup book showing their first kiss.) Ugh! Lame!"
4,27,Stacy,"Oh, come on, Candace. You're overthinking this. (The cashier puts a watermelon on the tread.) Jeremy'll love anything you make. What's your worry?"
4,27,Candace,I just wanna do something really special to show Jeremy how much I care. Something way over the top! Something that defies the laws of physics and excedes the boundaries of the imaginatio— (realizes what she's talking about) Oh no.
4,27,Stacy,"Oh, yes."
4,27,Candace,No no no no no! Anything but that!
4,27,Stacy,You're going to have to ask for help from...
4,27,Candace,Phineas and Ferb. (Puts her head in her hand like she has a migraine.) Uggggh.
4,27,Phineas,"Well, now that we've ironed out the bugs in our fusion-powered popper, the popcorn is nice and fluffy...and no longer glowing, so we're good to go. (Candace comes in mumbling under her breath.) Uh, what's that, Candace?"
4,27,Buford,"Lemme talk to her, guys. I speak sullen."
4,27,Buford,Candace messed up and now Jeremy's birthday is ruined.
4,27,Candace,Hey!! You completely misinterpreted what I said!
4,27,Buford,Nuance.
4,27,Phineas,"So what's goin' on, Candace?"
4,27,Candace,"(sighs) It's Jeremy's birthday and I wanna do something really special to show I care and you guys are good at doing, you know, what you do, and, well, all I have is this scrapbook and I don't wanna blow it so can you help me, huh? (gives Phineas the book)"
4,27,Phineas,"Wow! This is great! It's like a blueprint! Ferb, I know what else we're gonna do today!"
4,27,Candace,"Great! Start workin' your magic and, no pressure, but it's gotta be PERFECT!!!"
4,27,Phineas,We'll do our best!
4,27,Candace,(mumbling) Thnk yu.
4,27,Buford,"Oh. She said, ""Where's Perry?"""
4,27,Candace,You have got to work on your sullen!
4,27,Major Monogram,"Hey, there, Agent P! Well, it's Horrific Movie Night at my house where a bunch of agency guys get together and make fun of ridiculously bad movies."
4,27,Carl,He's always the guy shushing everybody.
4,27,Major Monogram,"Well, there's a time for fun and a time to pay attention."
4,27,Carl,Pfft.
4,27,Major Monogram,"Anyway, Agent P, when we went to rent tonight's horrific horror classic, Night of the Living Torso, it was already gone. In fact, all the movies within the horror genre throughout Danville have been checked out, which is definitely a bummer, and could possibly be evil. Go check on Doof and see if he's bogarting those movies...uh, before 6:30 if possible. (Agent P raises his arms up, and a pair of mechanical arms give him his jet pack. He blasts off.)"
4,27,Linda,"Candace, I'm headed out."
4,27,Candace,"(trying to not sound suspicious) Okay, Mom."
4,27,Linda,What's with the box?
4,27,Candace,"Oh, uh, nothing. I just wanted to see what this stuff looked like outside."
4,27,Linda,"Candace, is this a ploy to get me to go outside to see what the boys are up to?"
4,27,Candace,"No!! Er, I mean, uh, no need. (pushing her mom out) Just go out and, uh, feel free to stay for a while. Stay out all afternoon in fact. Heh-heh, heh."
4,27,Linda,"Reverse psychology. Nice try, hon. Glad to see you changing it up. See ya later."
4,27,Candace,"Okay, bye."
4,27,Candace,So here's all the Jeremobilia I could find. (gives the box to Phineas) Now what?
4,27,Phineas,Cool! (Ferb gives Candace a camera) Now just go around town and take pictures of all the Jeremy-related places and things you can. The camera will transmit them back to us to incorporate into our mega-interactive scrapbook-aganaza.
4,27,Candace,"No problemo! Candace is on field duty, peace!"
4,27,Phineas,"I'm sorry, were you gonna say something? (Isabella shrugs.) Okay."
4,27,(Cut to,)
4,27,Doofenshmirtz,"(sighs, pauses the movie) Isn't that always the way? Right at the exciting part, that's when the doorbell rings...or, y'know, a platypus breaks it down. Anyway, behold the Worst-Fear-inator! (pause) What? (Doof tilts his head. POV shot from Doof as he sees the popcorn cart is blocking the inator.) Oh, yeah, I-I guess from your point of view, it's a little difficult to see. Lemme just get this outta the way for you. (He pushes the popcorn out out of the way.) There we go. Now, in my never-ending pursuit of domination, I discovered that the best evil rulers used fear to keep people in line. So to get into the right headspace, I did what any logical evil scientist would do: rented all the scary movies in Danville for research. Even the lousy ones like Dead Batteries, which is actually better than its prequel, Batteries That Work, which was...just a bunch of...portable electronic devices...functioning properly."
4,27,Doofenshmirtz,"(voiceover) Once I was terrified, I was able to analyze the fear-based synapses of the brain and extrapolate some wonderful data!"
4,27,Doofenshmirtz,"Basically, I shoot someone with the machine, and whatever they are afraid of actually appears...in real life! Whadaya say, Perry the Platypus? Ya like being a guinea pig? Actually, you'd look kinda cute as a guinea pig. I mean, I wonder if you'd be teal. I bet you would. I bet you'd be a cute little teal guinea pig. Something to think about for the future. Anyway, Perry the Platypus, let's fire this baby up and see what scares you. (He presses the button activating the inator.) 'Cause, y'know, it's gonna materialize right over there. (A green beam hits Perry.) Alright, so what are you afraid of, where is it? (looks around) What the hay? Nothing? (A business card slips through the ropes. Doof takes the card and reads it.) ""Perry the Platypus: O.W.C.A. agent - Fearless."" Huh. That figures. I guess you'll just hafta...hang around! Ha ha ha! Oh, wait, this one's better: I'll just leave you here because you're all tied up! Ha ha ha! W-W-Wait, one last one, you're gonna love it: See ya later because it isn't my tail that's upside down! (No response.) No? No no, I shoulda stuck with the first two, you're right."
4,27,Candace,"Ooh, score! That awning is the same color as Jeremy's eyes! (snaps the photo) Aaaand...daffodils! Just like the ones he gave me on our third date! (Snaps the flower.)"
4,27,Phineas,"Incoming. Perfect! Same color as Jeremy's eyes! Huh, flower. I'm drawin' a blank."
4,27,Ferb,"Daffodil, third date."
4,27,Phineas,"Riiiight...Now the machine will take the images, and print them into giant scaled-up form."
4,27,Buford,Nice touch! Smells like my grandma!
4,27,Phineas,I thought your grandma smelled like ant pheromones.
4,27,Buford,"Naw, that's the other one."
4,27,Phineas,These should really make Jeremy's Birthday Scrapbook-aganza a full sensory experience!
4,27,Buford,"(sarcastically) Great, just what I always wanted: to fully sense Jeremy."
4,27,Candace,"Okay, what else? Ah! (She walks up to a couple drinking outside a French café. She takes the man's mug.) 'Scuse. Hot cocoa! (Snaps the mug and sips.) Not bad, although Jeremy prefers it with a little more cinnamon. (Walks away.) I gotta make a note of that for the boys."
4,27,Man,"I guess my fortune came true. ""You will share your cocoa with a long-necked teenager."" See? Right there."
4,27,Woman,"Mine just says, ""Your boyfriend's gonna get a fortune cookie at a French café."""
4,27,Doofenshmirtz,"Get ready, Perry the Platypus! The Tri-State Area's about to confront its fears! (Evil laughter from Doof. Another business card with mechanical arms and legs slips through the rope and crawls up to Perry's tail. A laser beam shoots through the robot and burns the rope down, freeing Perry. He kicks Doof.) Aaah! Ow ow! I landed on my jawbone, right under that weird...sticky-outy part under your ear! And my jawbone landed on the remote. Ah, Doof. (The inator activates and shoots Doof.) Okay, nothing bad will happen as long as I don't think about anything scary or... (A pounding on the door is heard.) Oh no! I couldn't help it, it just popped in there! It can't be! (The door breaks down revealing evil vending machine robots.) Vending machines are taking over! I said it could happen! No! Stay back! Stay back! Back! Flee! Flee! (Doof attempts to escape, but the vending machines grab hold of him.) No no no no! I'm not really hungry! Really! (Stutters) No no, not the tiny vanilla cookies! How long have those been in there?! (The machines force feed Doof a packet of vanilla cookies.)"
4,27,Phineas,"Hey, Candace, the scrapbook-aganza is complete! Plus, we got Love Händel to come in for a live soundtrack!"
4,27,Danny,"Okay, guys, performance level! (Strums the intro)"
4,27,Candace,I'm gonna need a test run so I can make notes.
4,27,Phineas,Sure. You're the boss.
4,27,Candace,That's right.
4,27,(Song,Giant 3D Scrapbook)
4,27,Love Händel,"♪ The way you play guitar, that crazy octave reach, ♪"
4,27,Phineas,"That sounded great guys, but it's a B-natural in the chorus!"
4,27,Danny,Toldja!
4,27,Bobbi,That's what I was playing!
4,27,Doofenshmirtz,"(offscreen) No! No! Not that! Anything but the fake red licorice! It tastes like... (Doof grunts. Perry stops walking and figures he has to save Doof.) No! What possessed me to make such a horrifying inator?! (Perry jumps on the DVDs and hops onto the inator aiming it. He lands on the floor and hits the remote. The inator hits the vending machines. A giant nickel rolls by and the machines run for their lives.) Well, I guess now we know what scares vending machines."
4,27,Phineas,"Well, Candace, do you think Jeremy will like it?"
4,27,Candace,"(seriously) Yeah, I just have a few notes here. (Excitedly, as she reveals she drew a smiley face on the clipboard.) It's perfect! (gasps) I love it, guys! Iloveitiloveitiloveitiloveitiloveitiloveitiloveitiloveitiloveit..."
4,27,Phineas,"(to Ferb) She had me at ""smiley face""."
4,27,Doofenshmirtz,"Perry the Platypus, you're back! (walking up to the inator) I am never setting that puppy off again. (He presses a button, and, as usual, the inator activates and aims across town.) Oops."
4,27,Candace,"It's really perfect! (The beam hits Candace.) I'm glad Mom's gone for the day 'cause my biggest fear is that this is just gonna fly away before Jeremy gets here. (car horn honks, Candace gasps) And there he is! (runs off) Woohoo!"
4,27,Baljeet,"Uh, did anyone else see that weird green beam?"
4,27,Buford,I wasn't gonna mention it.
4,27,Candace,Jeremy!! Jeremy Jeremy Jeremy Jeremy Jeremy!!! You gotta see what the boys built in the backyard!!! (drags him)
4,27,Candace,(runs up) No no no! No no!! It's gone! My worst fear has come true! I totally blew it!
4,27,Jeremy,"Let me guess, you had your brothers build me something super cool for my birthday and now it disappeared. It's okay, I get it."
4,27,Phineas,"We don't have the invention anymore, but here's what we used as a blueprint. Candace designed it herself."
4,27,(Song,Regular Sized Scrapbook)
4,27,Love Händel,♪ It's a regular-sized scrapbook and it's all about you. ♪
4,27,Doofenshmirtz,"Oops. I really meant to hit the self-destruct button. I'll just get this for you. (Kaboom!) So, uh, you need your parking validated or, uh... Oh, oh, you found a spot on the street! Huh! Lucky you! Curse you, Perry the Platypus and all that! You know."
4,27,Phineas,"Isabella, you've been awfully quiet all day."
4,27,(Song,Watchin' and Waitin' (instrumental))
4,27,Isabella,"(looks at her watch) I have just earned my 24 Hours of Silence Patch! I can see why you don't talk much, Ferb. I actually quite enjoyed it. I ended up having an inner dialogue with myself all day."
4,27,Ferb,Welcome to Ferbland.
4,27,Ferb head #1,"Yes, the universe is constantly expanding."
4,27,Ferb head #2,But what is it expanding into?
4,27,Ferb heads,Ooooooh...
4,27,Ferb head #3,"Okay, now my mind is blown."
4,27,Love Händel,"♪ The way you play guitar, that crazy octave reach, ♪"
4,33,Phineas,"(from inside) Okay, Ferb, let's get this early morning party started."
4,33,(Song,Quirky Worky Song)
4,33,Reginald,"Okay, prepare for landing. That's it, lad, don't let the turbulence throw you. Ha ha! Ha ha!"
4,33,Lawrence,"Roger that, Papa Bear."
4,33,Reginald,I'm so glad we can still have our Father's Day jaunt in the biplanes.
4,33,Lawrence,"Oh, yes, modern technology's wonderful. I know it's not quite the quite the same as..."
4,33,Phineas,"(him and Ferb walk in the hallway) Hang on, Ferb."
4,33,Lawrence (cont'd),...the real thing but I suppose it's better than nothing.
4,33,Phineas,"Whoa, Ferb, I know what else we're gonna do today. (walks in Lawrence's room) Surprise! Happy Father's Day, Dad. And you too, Grandpa Reg."
4,33,Reginald,"Hello, boys."
4,33,Lawrence,"Oh, how lovely. Breakfast in den."
4,33,Phineas,(reveals the Phineas and Ferb pancakes) Ferb and I pulled out all the stops.
4,33,Lawrence,"What excellent likenesses! Ha ha ha! Thank you, boys."
4,33,Candace,"Happy Father's Day, Dad."
4,33,Reginald,"(on the computer) Hello, Candace."
4,33,Candace,"(in Cockney accent) 'Ello, Grandpa Reg. (normal voice) Happy Father's Day."
4,33,Reginald,"(on the computer) Thank you, love."
4,33,Linda,"Hello, Reg. Are you having a ""Grand""-Father's Day? (laughs) Hoo hoo!"
4,33,Reginald,Ha ha ha! Good one!
4,33,Linda,"I'll leave you boys to your Father's Day fun. Candace, are you ready to go?"
4,33,Candace,"Sure, mom. Bye, grandpa."
4,33,Reginald,"'Ey, where's Perry?"
4,33,Major Monogram,"Morning, Agent P. I see you're trying out the new SFU 2000. It's a lot of fun, but don't let your duties slide."
4,33,Carl,"Agent P, what do you think of his Father's Day gift?"
4,33,Major Monogram,"Yes, it's a lovely tie, but I'm not your father! (to Perry) Anyhoo, Doofenshmirtz has plans to gum up the entire Tri-State Area. And we need you to check it out. Good luck, Agent P."
4,33,Doofenshmirtz,"Gotcha, Perry the Platypus! If you think this is a sticky situation, you better hold on to that fedora. Behold, the Gum-Under-The-Shoe-inator! I took all the wadded up chewing gum in the entire Tri-State Area and fed it into this -inator. Yeah, I know, it's really unsanitary. Why don't people just throw the chewing gum in the trash? Huh?"
4,33,Doofenshmirtz,(sighs) Today just isn't my day. It's Father's Day. It's the hardest of the greeting card company holidays for me. My issues with Father's Day began back when I was a child.
4,33,Doofenshmirtz,(voiceover) Those were lean times for my father and our beloved lawn gnome was repossessed.
4,33,Doofenshmirtz,"Okay, I know you've heard that one before, but...twice actually...but I really think that this is where my relationship with my father went awry."
4,33,Doofenshmirtz,"(voiceover) I mean, he made me be that lawn gnome!"
4,33,Doofenshmirtz's Dad,"Bewegen sie nicht! (""Don't move!"")"
4,33,Doofenshmirtz,"I mean, he was really specific, too. He made me memorize the serial number of that particular lawn gnome. (While he talks, Perry goes onto the computer and opens the Lawn Gnome Tracker app.) DAEHM23. If only there was some way to reunite him with, y'know, that specific lawn gnome, maybe he and I could start again. (Looks at the computer.) DAEHM23?! You found him with an online gnome tracker? Wow, there really is an app for everything now, isn't there? Well, let's see. It says it's still in Drusselstein! Now I can heal the old wounds between my father and me! (gets up and walks but is stuck to the chair) Oh, man that is one of my most brilliant ideas yet! (His pointy nose pops the huge bubble made from the gum.)"
4,33,Phineas,An exact replica of Grandpa's old biplane! Dad's gonna love this! (He and Ferb climb in and put on their helmets and goggles.) Let's try 'er out! (The plane takes off.) Now punch it! (Ferb pushes a button on a remote control and four jet engines come out from the wings and the plane increases speed.) Yeah!
4,33,Doofenshmirtz,(offscreen) I know traveling by cannon is a little unconventional...
4,33,Doofenshmirtz (cont'd),"...but the cannon place was going out of business, so I got them at a volume discount. (lights the fuse) Hang on. (The cannon fires.) Woohoo!"
4,33,Vanessa,"Happy Father's Day, Dad! Dad?"
4,33,Doofenshmirtz,"Sorry for the lack of inflight meals or entertainment, Perry the Platypus, but one cannon can only go so far, so I set up a worldwide network."
4,33,Doofenshmirtz,Aw man! Missed it by that much!
4,33,Phineas,"Perfect landing, Ferb! I'll go get Dad. (Cut to the sliding door. Phineas leads his father out.) No peeking, Dad! Keep 'em closed! Okay, open 'em!"
4,33,Lawrence,(gasps)
4,33,Ferb,Tada!
4,33,Lawrence,"(voice breaking in tears) Thank you so much, boys! I can't think of a better Father's Day gift!"
4,33,Phineas,"Actually, there's a hidden feature you might wanna check out."
4,33,Reginald,"(emerging from the passenger seat) 'Ello, son!"
4,33,Lawrence,D-Dad?! B-B-B-But...
4,33,Reginald,C'mon! Give us a hug!
4,33,Lawrence,"(hugging his father) Oh, happy Father's Day!"
4,33,Reginald,What do you say we go on our traditional Father's Day flight?
4,33,Lawrence,Race you to the cockpit!
4,33,Phineas,Have fun!
4,33,Lawrence,What are you two standing there for? You're part of the tradition now! Come on!
4,33,Phineas,Cool!
4,33,Reginald,Right then! Engine...contact...
4,33,Lawrence,Here we go!
4,33,Lawrence,Wooooooooo!
4,33,(Song,Fletcher Family Flying Circus)
4,33,Lawrence and Reg,"♪ In our two wing aeroplane, ♪"
4,33,Lawrence,♪ I'm his son and he's me dad! ♪
4,33,Reg,♪ And I look really grand in plaid ♪
4,33,Lawrence,"Nice ad lib, Dad!"
4,33,Reg,"Thanks, son, I just roll with it."
4,33,Lawrence and Reg,Like you do!
4,33,Doofenshmirtz,"Ah, Drusselstein! This way, Perry the Platypus. (Doof and Perry get up and the cat meows. Cut to outside Ye Olde Pawn Shoppe.) Okay, so the gnome tracker located my father's long lost lawn gnome to this location. (He opens the door and gasps.) There it is! (He picks up a lawn gnome, but it talks.)"
4,33,Gnome,"Hey, put me down!"
4,33,Doofenshmirtz,Ah! I thought you were my father's lawn gnome.
4,33,Gnome,No worries. I get that all the time. Probably due to my height combined with my eccentric fashion choices.
4,33,Doofenshmirtz,"Uh, yeah. Huh. Well, I'm looking for DAEHM23."
4,33,Gnome,"(picks up the real lawn gnome behind him) Oh, yeah, it's been here for years. Here you go."
4,33,Doofenshmirtz,"It is you! My father will be so happy! Well, maybe not happy, but anything is an improvement over surly and dismissive. Let the father-son healing begin! (He arrives at the old Doofenshmirtz house and takes Perry out of the baby carrier.) Wish me luck, Perry the Platypus! (Perry smiles and gives him a thumbs-up.)"
4,33,Doofenshmirtz,(knocks and opens the door) Hello? Father? You're never going to guess what I brought y— (He trips on the floor mat and the gnome shatters to pieces.)
4,33,Doofenshmirtz's Dad,"Oh, hello, Heinz."
4,33,Doofenshmirtz,"(sadly) Hello, Father."
4,33,Doofenshmirtz's Dad,"I see you've brought me assorted broken bits of pottery for Father's Day. Well, I suppose it's the thought that, um...counts. Your brother, Roger, remembered how much I loved that old lawn gnome, so he sent me this. (walks up to a giant lawn gnome) Look, it also makes espresso. (The gnome opens a compartment door and an espresso spout pours some into a mug, which Doofenshmirtz's dad takes out and sips.) Delicious. But, you know, rubble is...a nice gift, too."
4,33,Doofenshmirtz,"(voice breaking in tears) Alright...um...Happy Father's Day. And...okay, bye-bye. (leaves)"
4,33,Doofenshmirtz's Dad,All zis way just to give me broken shards of potter— (gasps and sees the serial number) DAEHM23?!
4,33,Doofenshmirtz,"(sighs) Well, that could've gone better. (Perry consoles him.) Why do I even bother, huh? At least there's one relationship in my life that's worked out pretty well. Thanks for coming along, Perry the Platypus. Let's go home. (They walk away from the curb.) You are my rock. (Cut to a cannon.) And by that, I mean you're there for me, you're not made out of rock. You're actually made out of...well, platypus, probably. (They climb into the cannon, which fires.)"
4,33,Lawrence,"Well, that was the best Father's Day flight yet! It brought back some some wonderful old memories and created a lot of new ones. Thank you, boys, for making this possible!"
4,33,Phineas and Ferb,(hugging their father) Happy Father's Day!
4,33,Lawrence,Yes. Yes it is.
4,33,Reginald,Crikey! It's getting late! I best be on me way home. Mind if I borrow your new aeroplane?
4,33,Lawrence,Why don't you hang onto it 'til next year? I've got no room left in the garage anyway.
4,33,Reginald,Will do! Cheery-bye!
4,33,Linda,"Hi, honey! Hi, boys! So how was your day?"
4,33,Lawrence,"Oh, the boys and I spent a wonderful day flying with Father!"
4,33,Linda,"Ah, the internet is a wonderful thing."
4,33,Lawrence,"Well, yes, I...pfft...s'pose it is."
4,33,Linda,"Well, here's something special from Candace and me."
4,33,Candace,(giving her father a gift box) Here you go!
4,33,Lawrence,"(opening the box) Oh, my! An exact replica of Father's biplane! Oh, it's perfect! (giving his daughter a hug) Thank you so much, sweetheart!"
4,33,Candace,"Happy Father's Day, Dad!"
4,33,Doofenshmirtz,"(reading) ""To the most evil dad in the whole world, Happy Father's Day. Love, Vanessa."" Aw, a gift basket of switches and self-destruct buttons. (pushes a self-destruct button) That's my girl! (smiles)"
4,33,Doofenshmirtz's Dad,"Bewegen sie nicht! (""Don't move!"")"
4,1,Phineas,"Okay, Ferb. Open the floodgates. (Ferb turns the hose open and water comes out from the sprinklers): What do you think?"
4,1,Baljeet,"It is like our own miniature Canada! But, of course, without the beavers, moose, and disproportionate number of comedians."
4,1,Phineas,Or Canadian bacon.
4,1,Buford,I forgot all about Canadian bacon.
4,1,Baljeet,You realize it is only ham.
4,1,Candace,(Off-screen) Phineas! (Walks on screen) And Ferb! You are so busted!
4,1,Lawrence,"Hello, boys, splendid job on the hockey rink. (He crashes into a snowbank) Well, that was amusing."
4,1,Phineas,"Great skating, Dad!"
4,1,Lawrence,"Boys, I've got some good news for you. I've arranged for you to play a little exhibition match between the periods of the Danville Ice Trays game."
4,1,Phineas,"Oh, you mean like at halftime?"
4,1,Lawrence,"Well, it's three periods, so it's really two-thirds time."
4,1,Buford,Bland sports terms. That's what keeping the Canadians down.
4,1,Phineas,"If we're going to be the entertainment, then we'd better kick it up a notch. Hockey Z-9?"
4,1,Ferb,Hockey Z-9.
4,1,Buford,"Oh, like Football X-7."
4,1,Baljeet,What happened to Y-8?
4,1,Phineas,"Oh, we're saving that for croquet. Ferb, grab your toolbox. We've got work to do. (they exit)"
4,1,Candace,(scoffs) What's the big deal with hockey anyway?
4,1,Lawrence,"Well, it's hard to explain actually, taking the flip pass from the winner, shoulder deking the defense men, and then, tossing it right over the old glove hand. Oh, it just takes hold of you like a fever!"
4,1,Candace,"Did you play a lot of hockey in England there, Dad?"
4,1,Lawrence,Never once.
4,1,Jeremy,"(off-screen) Hey, Candace. (walks right on-screen behind Candace)"
4,1,Candace,"Oh, hi, Jeremy."
4,1,Jeremy,What a great ice rink.
4,1,Candace,Wouldn't it just be perfect for figure skating?
4,1,Jeremy,"(as Candace says ""figure skating"") Ice hockey!"
4,1,Candace,What? Oh yeah. Ice hockey.
4,1,Jeremy,"I didn't know that you were a hockey fan, Candace."
4,1,Candace,"(chuckles) You betcha! Flipping over win passes, and then shoulder dorkin' the old jazz hands. It's like some kind of disease!"
4,1,Jeremy,Uh... yeah.
4,1,Lawrence,"Say, Jeremy, why don't you join us at the exhibition game today?"
4,1,Jeremy,Sounds like fun.
4,1,Candace,"Oh yeah. Sounds like... (makes phone noise) BRRRRING!! Oh, hey. I got a phone call from, um... a real person. Gotta go. (walks out of backyard, calling Stacy on her phone) Stacy, we have a Code Teal."
4,1,Stacy,(looking at a color wheel) Locusts? Are you sure?
4,1,Candace,"No, wait. I mean Code Periwinkle."
4,1,Stacy,Periwinkle. A hockey emergency? I'm on it!
4,1,Candace,"Speaking of periwinkle, where is Perry?"
4,1,Major Monogram,"Carl, I'm freezing. Did you call that repair guy yet?"
4,1,Carl,"I left him a message, sir. I think he went to Aruba for winter break."
4,1,Major Monogram,"Lucky dog. It's cold in... Oh! Agent P! Didn't hear you come in. I have no idea what Doofenshmirtz is up to. It seems all of our computers froze. Isn't that right, Carl?"
4,1,Carl,(is seen with his hands inside an ice-encased computer) Tech support says everything is fine.
4,1,Major Monogram,"Well, I'm sure whatever Doof is up to, he's probably much warmer than we are, and that alone should be reason to stop him! Good luck, Agent P! (Perry salutes and exits his lair)"
4,1,Dink Winkerson,"Welcome, hockey hounds, to the hypothermic hippodrome of Danville Mountain Top Winter Arena where our own Danville Ice Trays will cross sticks with the combative cross-town contenders. Reigning over the skating skirmish tonight as guest referee is Hockey Hall of Famer, Luc Robitaille!"
4,1,Luc Robitaille,Is anyone else cold? Why is it so cold in here?
4,1,Audience,"We don't know, Luc Robitaille!"
4,1,Man in audience,"Actually, I brought a blanket. So, I'm okay."
4,1,(Song,F-Games (instrumental))
4,1,Lawrence,Here we are.
4,1,Linda,"Oh, this is so exciting! I've always wanted to be a hockey mom."
4,1,Candace,"Excuse me for a second. (walks out and presses bluetooth button) System check. Stacy, can you read me?"
