season,episode,speaker,line
4,48,Major Monogram,What kind of a freak would make robot fleas?
4,48,Villain,Hello.. (laughs) Francis Monogram! (laughs)
4,48,Major Monogram,Great googly moogly! Who are you?
4,48,Villain,"I am Professor Parenthesis. Although, I'm not really here. This is a holographic image."
4,48,Carl,"Major, I'm looking up Professor Parenthesis in our database. There's not much on him."
4,48,Parenthesis,It's Parenthesis! Not Parenthesis!
4,48,Carl,Are you sure? Because it's spelled—
4,48,Parenthesis,You would think I would know how my own name is pronounced.
4,48,Carl,"Yeah, you'd think."
4,48,Major Monogram,Why are you here?
4,48,Parenthesis,You don't remember me. We were in biology class together long ago. You barely noticed me.
4,48,Major Monogram,"You're not that guy who kept eating his own hair, are you?"
4,48,Parenthesis,No. That was Jeffrey Stovel.
4,48,Major Monogram,Were you the kid who got his chin stuck in that graduated cylinder?
4,48,Parenthesis,"No, that was Jennifer Stillwell! And she was a girl! All you need to know is that I'm the one who sent those flea collars!"
4,48,Major Monogram,"Oh, are you that kid who wore that Robin Hood hat and passed out in the drinking fountain?"
4,48,Parenthesis,"Billy Youjeka! And can we move on, please?"
4,48,Major Monogram,"Yeah, sorry. So, why did you send those flea collars?"
4,48,Parenthesis,"Well, it's taken me 30 years to come up with a plan this diabolical. Five of those years were spent in villains academies. Then, after school, I started working on that screenplay I always wanted to write. But revenge was always on my mind, Francis Monogram!"
4,48,Major Monogram,Stop saying my name like that!
4,48,Carl,Didja ever finish that screenplay?
4,48,Parenthesis,This is my screenplay! (hands Carl his screenplay) Right here. I'd like to get your notes.
4,48,Carl,"Oh, I'd be happy to. (tries to pick it up, then remembers it's a hologram. To Monogram) Seriously?! You don't remember this jerk?!"
4,48,Major Monogram,Were you the kid who...
4,48,Parenthesis,The robot fleas were actually inside the flea collars that you put on all of your agents. Now this remote will give me complete control over all of them!
4,48,Parenthesis,"(maniacal laugh) And now, Francis Monogram, say goodbye to your precious OWCA! (maniacal laughter, then disappears, but reappears, to Carl) Seriously, though. I'll email you the screenplay. Tell me what you think. (disappears again)"
4,48,Carl,"Sir, he's turned all of our animal agents against us!"
4,48,Major Monogram,"Carl, are you familiar with the term ""a-duh""?"
4,48,Carl,"(offscreen) What are we gonna do, sir?!"
4,48,Major Monogram,Do we have any agents on the outside? Anyone without a collar?
4,48,Major Monogram,"Agent P. Come in, Agent P. Oh, good, you're all right. We need your help. OWCA's on lockdown. We're trapped!"
4,48,Major Monogram,And all of the agents are being controlled by a sinister being named Professor Parenthesis.
4,48,Carl,"That's Parenthesis, sir."
4,48,Major Monogram,"Oh, right. Anyway, Parenthesis is using robot fleas to control our agents' minds..."
4,48,Carl,Left turn!
4,48,Major Monogram,Whoa! He snuck the fleas into OWCA Headquarters by hiding them in a shipment of flea collars.
4,48,Carl,Right turn!
4,48,Major Monogram,"And now he's...Hey, Carl! Whoa! Anyway, he's controlling them with a small remote device. It's up to you and your team to find Parenthesis and destroy that remote. You're all we've got on the outside, so..."
4,48,Carl,Wet floor!
4,48,Major Monogram,Whoa! Great googly moogly!
4,48,Doofenshmirtz,"Wow, that sounds kind of serious. Guess the first thing we should do is start looking for clues? Huh? Huh?"
4,48,Maggie,(repeating what Monogram said) Shipment of flea collars!
4,48,"(Cut to Karen in a box labeled ""Contents","Flea Collars"".)"
4,48,Doofenshmirtz,"It's the box those flea collars came in. And there's his return address. ""The Bottom of the Grand Canyon."" Hey, hold on a second. Parenthesis! I know that guy! I met him at an evil convention about three years ago. Walks around in those pink slippers pushing his screenplay on everyone. Sure. (closeup on Doof) And now we got his home address! (Long shot to reveal Doof alone.) Perry the Platypus, we should go to your secret lair and get your hover car... (the rest are already ahead) Okay, fine, just... Just remember it was my idea!"
4,48,Napoleon,"Well, that did not go as planned."
4,48,Wendell,"(offscreen) Hey, Napoleon, there's peanut butter over here!"
4,48,Napoleon,"Floyd, your head is upside-down."
4,48,Wendell,"There's peanut butter over here, too! (gasps) There's peanut butter all over!"
4,48,Napoleon,"Yes, well, there's always a silver lining, isn't there? I think the problem is we need to be up on their eye level."
4,48,Wendell,Like those guys up there?
4,48,Napoleon,Uh...yes?? And no.
4,48,Butterfly,Tell my wife I love her.
4,48,Napoleon,"While th-their position is not advantageous, they are illuminated by a light, which gives me an idea."
4,48,Doofenshmirtz,"(panting) Man, you guys are... You guys are fast. Ah, so this must be your...your host family's house. What's with all the rockets in the r— Oh, those are mine! That must be where they landed! Wh-What a coincidence! Well, it's a good thing they're not armed or... (The rockets start beeping. Doof chuckles.) Don't worry, Perry the Platypus. Everything is gonna be okay."
4,48,Doofenshmirtz,"If I can get a ladder, I can defuse them before they blow up. (Notices the house is destroyed.) Eh. Well, on the bright side, now we don't have to find that ladder."
4,48,Doofenshmirtz,"Wow, what a mess. But don't worry, Perry the Platypus. OWCA's got plenty of money now. They'll... (snaps fingers) They'll fix this place up before your host family even gets back and they'll, they'll replace all this junk with...y'know, pretty much identical junk. (Harry gives him a look.) What?"
4,48,Doofenshmirtz,AAAAAAAAAAHHHH!!!
4,48,Karen,REOW!!
4,48,Doofenshmirtz,"Ah, see? A cat always lands on my feet."
4,48,Karen,Meow.
4,48,Doofenshmirtz,"Ooh, Perry the Platypus, is this your lair? Nice! At least it, it would be if it wasn't so, y'know, blown to smithereens. (He picks up and throws away a Perry the Inaction Figure.) Oh, hey, an underwater diving capsule. (He knocks it over.) Man, I see why you never use it. ♪ Fragile! ♪ And is that a pressurized space suit? 'Cause that is not what you wore when we were in space. Hey, check this out! (Picks up the locket from Phineas and Ferb The Movie: Across the 2nd Dimension.) Oh, you look so young! Who's a widdle pwatypus?! (He hears Perry starting his hovercar.) Where do you think you're going? (He throws the locket in the toilet.) No-no-no-no-no-no, look. I know you might be a little upset, what with your house and your lair so exploded and all, and... And I have to admit that I feel...slightly responsible..."
4,48,Maggie,(imitating the rockets) Beep beep beep beep beep beep beep beep beep... PYEOW!!!
4,48,Doofenshmirtz,"Yeah, thanks for the recap, Maggie. Anyway, you can't just go off and solve this without me."
4,48,Harry,(snorts)
4,48,Doofenshmirtz,"I was getting to you guys. I mean, without me and them. And the cat, wherever the..."
4,48,Karen,(purrs)
4,48,Doofenshmirtz,"Hmm. Anyway, I know we can't all fit in this, but...if we work together, there's a lot of blown up stuff lying around here, and I'm, I'm sure we can jury rig something that will carry, y'know, all of us. Like a well-bonded machine."
4,48,Doofenshmirtz,"Okay, the welds aren't really bonded on this machine, so, y'know, try not to move around too much in flight. Grand Canyon, here we come!"
4,48,Narrator,5 hours later...
4,48,Doofenshmirtz,"Yeah. If anyone happens to see a canyon that looks sorta grandish, just speak up. Or maybe not speak up, maybe meow up, or squawk, er, whatever it is that you do, up."
4,48,Maggie,Are we there yet? (plucks a feather) Are we there yet? (plucks a feather) Are we there yet? (plucks a feather) Are we there yet?
4,48,Harry,"Ha ha ha ha! Hee hee hee hee hee hee! (sighs, groans)"
4,48,Doofenshmirtz,Yeah.
4,48,Doofenshmirtz and Maggie,Are we there yet?
4,48,Doofenshmirtz,"(to Perry) I have no way of knowing, because I've never been there, and...you don't talk."
4,48,Maggie,Are we there yet? (plucks a feather) Are we there yet? (plucks a feather)
4,48,Doofenshmirtz,"Man, these guys are really annoying. Doncha think?"
4,48,Doofenshmirtz,"I'm right, aren't I? Annoying. Yeah, I'm right."
4,48,Parenthesis,"♪ Beautiful lunchtime, at my secret lair, in the Grand Canyon. ♪ Ah, I'm starving."
4,48,Parenthesis,"Well, that was delightful. I couldn't eat another gram."
4,48,Parenthesis,"Well, well. It appears someone has flown into my airspace. Perhaps we should send a welcome party."
4,48,Doofenshmirtz,"Ah, the Grand Canyon. It's nice. You got the Colorado River, you got the giant robot fleas. you got these nice red rocks right h— (gasps) Wait a second! The Colorado River?! I thought we were in Arizona! (gasps) And wait another second! Giant robot fleas?!? Yeah, those are definitely the attack drones of an evil scientist. Yeah, y-you're gonna wanna punch it."
4,48,Doofenshmirtz,"All right! Nice one! Oh, let me help. We gotta have some weapons around. Wait wait wait, what does this lever do? (pulls the lever several times) No, no, no, that, uh, it doesn't...it doesn't seem to do anything. (Cut to reveal Perry's seat hitting him, revealing what it does.)"
4,48,Doofenshmirtz,"Give me something to hit him with. (Takes the football helmet Karen is sitting in.) Thanks, Harry."
4,48,Karen,REEEEERR!
4,48,Doofenshmirtz,Take that!
4,48,Maggie,We lost the cat! We lost the cat!
4,48,Doofenshmirtz,"Oh, relax. The cat's right... (realizes she's gone. Rotates his seat at the fleas.) Take that! And that! One for you, too! There you go! Uh-oh. Where's Harry? Oh, there he is! I see a bright future for that kid. Well, y'know, if we survive today. Oh, and there's Karen. Hi, Karen!"
4,48,Carl,(whispering) The access vent won't take us any further.
4,48,Major Monogram,"The hallway is crawling with compromised agents. We're gonna hafta do some creative sneaking, Carl. Follow my lead. (They sneak around.) The cobra. (They do a pose, while Agent C passes by, not noticing them. They start sneaking again.) Andalusian dog. (They pose again, while Agent F passes by.)"
4,48,Agent F,Ribbit. Ribbit. Ribbit.
4,48,Major Monogram,Violin and candlestick. (They pose as Gary the Gander flies past them. They jump over some lamps and a desk chair offscreen.) Garden party.
4,48,Carl,(offscreen) Garden party?
4,48,Major Monogram,(offscreen) Just give me your ankles.
4,48,Napoleon,There. That should be sufficient wattage to illuminate us.
4,48,Wendell,Why do we wanna be laminated?
4,48,Napoleon,Not laminated. Illuminated. It means to have light shown upon us.
4,48,Wendell,Like a grape?
4,48,Napoleon,Yes. Like... Like a grape?
4,48,Wendell,"Yeah, I saw a grape this morning."
4,48,Napoleon,And there was light shining on it?
4,48,Wendell,"You saw it, too?"
4,48,Napoleon,Moving on. Do we have enough power for all these lights?
4,48,Wendell,"Yup. We're all plugged into that plug collector thingy, and all we have to do is turn it on."
4,48,Napoleon,"Well, let's do that then."
4,48,Wendell,Yes! And then we can all be laminated!
4,48,Napoleon,"No, it's illu... You know what? Nevermind. Floyd, when we get up on the box, you throw that switch!"
4,48,Floyd,I like laminated grapes.
4,48,Major Monogram,"Come on, Carl. Let's get outta here! (he opens the door, but it is blocked) Carl, what the heck?!"
4,48,Carl,"Well, it never occurred to me that the emergency exit would be locked down, too."
4,48,Major Monogram,Isn't that something you should've checked before we crawled through all that duct work?
4,48,Carl,"I suppose... but, I was... just having so much fun sneaking around with you."
4,48,Major Monogram,"Actually, I was kinda havin' fun, too. Heh heh. Nevertheless, this isn't a situation to make light of."
4,48,Napoleon,"Okay, Floyd. Make some light!"
4,48,Floyd,(jumping off the garbage can onto the switch) Weeee.
4,48,Major Monogram,"Ooh! (chuckles) Uh, (points to his right) We went that way! (runs the other direction)"
4,48,Carl,Heh heh heh... uhhhh... additional misdirect! (follows Monogram)
4,48,Wendell,Down here!
4,48,Napoleon,
4,48,Wendell,"Floyd, focus the beam!"
4,48,Floyd,"Stop, drop, and roll, sir."
4,48,Doofenshmirtz,"Well, you know what they say. Any landing where you don't get stabbed with a fork is a good one. And I didn't get stabbed with a fork. Any of you guys? Hello? Harry?"
4,48,Harry,(whistles)
4,48,Doofenshmirtz,"Oh, there he is. Impressive! Y'know, as, as evil lairs go, I give that, like, an eight. It looks like a classic mid-'60s megalomaniacal design. And the water feature is very nice. Fortunately, I know a thing or two about... (pull out to reveal Doof alone again) Sheesh! (Doof goes over to the others, who are looking at a scale model of the lair.) Oh, heh. Yeah, w-way to get the ball rolling there, Perry the Platypus. I-I see you're gonna use the... (looks at the manual) Standard Evil Fortress Infiltration Technique, or SEFIT. Man, these guys are really bad at acronyms. Good choice, though. Wh-What do I get to do? (stammers) What's my part? (Perry points behind Doof as he sees a coffee shop.) Oh, I'm the coffee guy. Good start. We're gonna need to stay sharp on this one."
4,48,Doofenshmirtz,"Okay, I'm back. Eh, who had the double espresso? (Harry takes it.) There you go. And a caramel macchiato. (Maggie takes it.) Maggie. And I guess that means that Perry the Platypus had the... Yes, the oolong tea, of course. And I got a scone, but it was like, five dollars. So I only got one. Oh, you got little figurines. There's Harry, and Maggie, and eh, where's my little guy? (Perry picks up a rock and paints a crudely-drawn Doof onto it.) Ah, that's sorta nice, it's... (Perry places Doof by the model of the coffee shop to make a point.) Oh, wh-wh-while you guys do that, I'll just be back...over... Alright, well, I guess I'll just be over... over here if you need me."
4,48,(Song,They Left Me Standing Outside)
4,48,Doofenshmirtz,I coulda helped. I understand the Standard Evil Fortress Infiltration Technique. Step one: Diversion.
4,48,Parenthesis,"(to his robot fleas) Jason, Shirley, water is no longer coming out of my hole. Get down there and see what you can do about it."
4,48,Doofenshmirtz,(voiceover) Step two: Immobilization.
4,48,Doofenshmirtz,"Step three: Infiltration. They'll take them completely by surprise. They'll just walk right in the door past that giant lava lamp, and... Why would there be a giant? (record scratch) IT'S A TRAP!!"
4,48,Parenthesis,"Ah, Perry the Platypus and friends. Right on time. Actually, you're a little early. (drops open the trap door) Ah, now you're on time!"
4,48,Parenthesis,"Well, well, well, now that you're all bottled up, I'm free to go to OWCA for the culmination of my evil plan! In 28 minutes, my fleas will have worked their way into each agent's neuro-pathways. And then my mind control will be permanent! I will single-handedly take control of every OWCA agent! (to some fleas) Susan, Jim, Tracy, Connie, to the Parentho-Copter! (to the trainees) I hope you find my accommodations uncomfortable. (lights a wrecking ball on fire and releases it) And yes. Soon it will be worse."
4,48,Karen,Meow!
4,48,Doofenshmirtz,"Aw, looks like you might need my help after all! Lucky for you I brought a rope, with a dreamcatcher on the end! That's what you call style! Anyway, alright, here, catch. (throws the dreamcatcher at Karen, but she pushes it off the edge) Uh, Karen, I don't think you're grasping this whole ""grab the rope"" concept. Can someone else get this one? (it gets tangled in the wrecking ball) Oh, great, now it's tangled in the... AAAAAHHHH!!! (The wrecking ball ends up in the capsule.) Wow! Did you guys see that? I almost got— Alright, minor setback. No problem. I'm just gonna have to come down there and get you myself. (Pushes a rubber raft through the door.) See, this is why I brought the raft."
4,48,Doofenshmirtz,"Okay, I might have a little bit of a pro— (falls down and ends up in the water. He gets on the raft but is surrounded by alligators.) Get back, you, before I get all Creole chef on you! (to the trainees) Come on, you guys! Jump! I gotcha! I gotcha! I got— (the trainees jump into the raft)"
4,48,Karen,Reeeeeooww!
4,48,Doofenshmirtz,"See? A cat always lands on my feet. Wait, nobody move. Here. (takes a selfie) That's goin' on my blog."
4,48,Doofenshmirtz,"Well, uh, that can't be good."
4,48,Doofenshmirtz,"Woo-hoo! Yeah! Woo-hoo! Woo! Woooo! I did it! I saved you guys and now we're safe! (some alligators land in their raft) Except for the fact that it's, you know, raining alligators. And secret lairs."
4,48,Major Monogram,"Good thing we found a hiding place, Carl. What is this? A dining room table or something?"
4,48,Carl,"It's a desk, sir."
4,48,Major Monogram,A desk we can both hide under? Whose office is this anyway?
4,48,Carl,"It's mine, sir."
4,48,Major Monogram,Yours?! This is at least ten times bigger than my office!
4,48,Carl,"Sir, that's not important now! We need to find a way to escape!"
4,48,Major Monogram,And how do you rate your own bathroom?
4,48,Carl,"It's actually a gym, sir."
4,48,Major Monogram,Is that a chocolate fountain?
4,48,Carl,"Sir, listen. I got an idea. If we can get to the evacuation wing, we might be able to use one of the escape pods."
4,48,Major Monogram,What's up with the giant bear?
4,48,Carl,Oh. That was a gift from our contractor.
4,48,Major Monogram,That gives me an idea! But this conversation isn't over.
4,48,(Song,Friend Like Mine)
4,48,Carl,"I can't see back here, sir."
4,48,Major Monogram,"You drew the short straw, Carl."
4,48,Napoleon,"Just a little higher. Ah, we've finally reached the summit. Come, gentlemen, it's time to get noticed!"
4,48,Wendell,"Oh, boy! Oh, sorry, Floyd, are you okay?"
4,48,Floyd,"Wendell, I've had an epiphany! In order for us to obtain our noble goal, we must evaluate the— (groaning) Ow."
4,48,Wendell,"Sorry, Floyd, did you say something?"
4,48,Floyd,I like trains.
4,48,Wendell,"Oh, my! By my larva-making mother, would you look at that! It's like the floor is frozen, but it's warm. It's like warm ice. Did we discover this? We should call it ""wice""."
4,48,Napoleon,"Actually, it's called glass."
4,48,Wendell,"No. I think it should be some combination of warm and ice. Floyd, come take a look at this!"
4,48,Floyd,I need a face shoe.
4,48,Wendell,"So, what's your plan, Napoleon?"
4,48,Napoleon,"Ah, it's quite simple, actually. We are standing atop a giant duplication device. A device that will not only copy our images, but will enlarge us as well. I simply need to program in the right size. Let's see. 200% enlargement. Okay, men, get on the glass platen, and get ready to be enlarged."
4,48,Wendell,"All set, Napoleon!"
4,48,Napoleon,And (jumps on the button) copy! Everyone smile for the camera. (The copier scans them) Excellent! Now we just have to wait for the toner to do its work.
4,48,Napoleon,"Well, yes, Wendell, that was fortun—"
4,48,Doofenshmirtz,"Y'know, it, uh... It could've been worse. Uh, don't..don't all thank me at once. Knowing my talent has served my fellow agents is thanks enough."
4,48,Maggie,Rawk! Lousy rescue!
4,48,Doofenshmirtz,"I wouldn't call it lousy, per se. A little off, maybe, but... Oh, come on. Harry the Hyena, it was a good rescue, wasn't it?"
4,48,Harry,"A-hee-ha-ha-ha-ha! A-ha-ha-ha ha ha ha ha. Eh, heh heh... Eh... Nah."
4,48,Doofenshmirtz,"Karen the Cat? Anything? Uh, no? What did you think of the rescue, Perry the— (Perry throws the training manual at Doof) Ow! (Perry takes off in his jet pack) Hey, Perry the Platypus, you're leaving us?!"
4,48,(Song,Bits of All of Us)
4,48,Doofenshmirtz,"(shooing the letters away) Knock it off! Hope that's not permanent. Oh, I get it! H-Hey, hey, you guys, come back. Come back! Now, let me just explain."
4,48,Maggie,Macaw!
4,48,Doofenshmirtz,"(gasps) That's right! ""Macaw"" has a ""W"" in it! So we can do it! Okay, here, from the beginning."
4,48,Carl,"There it is, sir! The escape pod!"
4,48,Major Monogram,Great! Let's get outta here!
4,48,Carl,"Okay, sir, but be careful. There's a huge set of stairs."
4,48,Major Monogram,"(sarcastically) Well, that went well."
4,48,Carl,"Sarcasm isn't helping, sir."
4,48,Major Monogram,"Aw, there we go— Aw, ow! Ow! Ow! Ow!"
4,48,Carl,"Okay, this button launches the escape pod."
4,48,Major Monogram,"(offscreen) Uh, Carl, how does the escape hatch work with, you know, this whole lockdown thing?"
4,48,Carl,(offscreen) Uhhh...
4,48,Major Monogram,Owwwwwww.
4,48,Parenthesis,"Well, well, well, Francis Monogram! It's hostile takeover time!"
4,48,Major Monogram,"Carl, how was he able to override the lockdown?"
4,48,Carl,"Well, it opens from the outside, sir."
4,48,Major Monogram,Ehhh.
4,48,Major Monogram,"Okay, you made your point, Parenthesis. Apparently, I didn't notice you in school. Sad story. Boo-hoo. But why are you here?"
4,48,Parenthesis,I'm here to make your days the darkest of grays and your nights the blackest of black. I want to see your smug smile melt away like the candles on a sad little abandoned birthday cake.
4,48,Carl,Sounds like he's here to bore us to death.
4,48,Parenthesis,"As soon as my mecha-fleas completely override your agents' natural instincts, I will release them out into the unsuspecting world, where they will wreak havoc. And all you'll be able to do is sit and watch as the people of the world grow to deride and despise Francis Monogram and his monstrous OWCA as much as I do!!"
4,48,Carl,(to Monogram) How about now?
4,48,Major Monogram,"No, I still don't remember him!"
4,48,Wendell,"Wow, Napoleon, we're huge!"
4,48,Napoleon,"Yes, this is bound to get us noticed."
4,48,Wendel,So how do we get them to see it?
4,48,Napoleon,"Well, it would be preferable if it were at their eye level."
4,48,Floyd,We could build a paper airplane.
4,48,Napoleon,"If we could find a staple remover, some dental floss... Wait, Floyd, what did you say?"
4,48,Floyd,I want a monkey?
4,48,Napoleon,"No, what did you just say?"
4,48,Floyd,I want a monkey.
4,48,Napoleon,What were the last words out of your mouth?
4,48,Wendell,"Well, actually, those were the last words out of his mouth. You asked him, ""What did you say?"" And he said, ""I want a monkey."" He said it twice, if you count this last time."
4,48,Napoleon,"Well, I...I... Okay, Floyd, immediately before you said ""I want a monkey"" twice..."
4,48,Floyd,I don't want two monkeys.
4,48,Wendel,Is this about the face shoe?
4,48,Napoleon,"Oh, forget it! We're making a paper airplane!"
4,48,Parenthesis,"Almost out of time! The suspense is delicious, don't you think? (laughs)"
4,48,Major Monogram,"Hey, Parenthesis, I wouldn't get too comfortable if I were you. Heh heh."
4,48,Parenthesis,What?
4,48,Major Monogram,"Nice upholstery job, Agent P! We got this guy. You take down Parenthesis."
4,48,Parenthesis,"Agents, you know what to do."
4,48,Agent E,(trumpets)
4,48,Parenthesis,Excellent! Soon all this will be mine! First thing I'll do is put that sofa back there on the atrium where it belongs. Then I'll—
4,48,Carl,"Oh, my gosh!"
4,48,Carl,Does that mean what I think it means?
4,48,Major Monogram,No. It means Parenthesis was... a robot.
4,48,Carl,"Alright. Well, now I'm confused. What did you think I thought it meant?"
4,48,Napoleon,There. This seems aerodynamically sound.
4,48,Wendell,Now all we need is a big rubber band and two palm trees to launch us!
4,48,Napoleon,"You watch way too much TV, Wendell."
4,48,Wendell,"Oh, just the one show."
4,48,Napoleon,"But, perhaps some form of propulsion would be beneficial. (Looks at the fan.) Hmmm."
4,48,Floyd,"Uh, guys. (cut to reveal Floyd's head not attached to his body) I think I got a paper cut."
4,48,Napoleon,"Uh, Wendell."
4,48,Wendell,I'll go get the gauze.
4,48,Major Monogram,"Well, I guess that's that. We should get that remote device and... (looks inside the body) Whoa! (the robot body grabs Monogram, and pushes Carl, and Perry onto the sofa.) Oh, no, I can't. (The robot body lifts Monogram up in the air so he can see inside.) What?"
4,48,Parenthesis,(laughs maniacally) Aloha!
4,48,Major Monogram,Wait. You're a flea?
4,48,Parenthesis,Recognize me now?
4,48,Major Monogram,Why would I recognize a flea?
4,48,Parenthesis,"See? See? There's that attitude again! (A TV set with multiple mechanical arms pops out of the robot's body. The TV shows the flea's face.) You've always looked down your nose at me. Well, now, who's beneath who?"
4,48,Parenthesis,"He's getting away! He'll ruin everything! Hold these, guys. Susan, Jim, Tracy, Connie, you're with me!"
4,48,Wendell,"Napoleon, how are you steering this?"
4,48,Napoleon,"I'm not, Wendell. We are at the mercy of the wind! YEEHAW!!"
4,48,Parenthesis,Get him!
4,48,Parenthesis,Where did the platypus go? (gasps) Connie! There you go. Lemme just straighten your collar. To the freeway!
4,48,Parenthesis,"How about a little oncoming traffic, you portentous platypus?"
4,48,Parenthesis,Yes! Finish him!
4,48,Parenthesis,What's this?
4,48,Parenthesis,"Here, little semi--aquatic mammal. Here, boy. Nowhere to turn now! Oh, look, I'm wearing glasses. I'm a hipster."
4,48,Parenthesis,"Okay, end of the line, platypus! You've nowhere to... Oooh, cotton candy! Give me some of that!"
4,48,Parenthesis,"Does anyone see him? He's small, teal, wears a hat. Oh, come on. How hard is it to find a small platypus in a carnival setting? Don't say it! I just heard myself."
