season,episode,speaker,line
3,58,Norm,I'm honored!
3,58,Suzy,Yes. What do you think? (shows Norm a mirror)
3,58,Norm,Self-interest dictates a tactful reply.
3,58,Jeremy,(Knocks on Suzy's door) Suzy? Are you there?
3,58,Suzy,"Yeah, just a sec! (To Norm) Quick, hide! (goes to open the door, shushes Norm, opens door)"
3,58,Jeremy,"(walks into room) Hey, sis. I can't find my lucky baseball bat. I've looked everywhere. Have you seen it?"
3,58,Suzy,"Uh... (She sees Norm, who is wearing a lampshade on his head and moves over so that Jeremy does not see him) Nope. Nothing in here that would be of any interest to you."
3,58,Jeremy,"Suzy, you're acting kinda weird. You're not hiding anything, are you?"
3,58,Suzy,No. (the siblings stare at each other) Get out of my room!
3,58,Jeremy,Holy guacamole! You sure are a handful. (He leaves)
3,58,Norm,(removes lampshade) Look at me! I'm the life of the party!
3,58,Suzy,My lamp needs a brighter bulb.
3,58,Guilbaud,"Of course I'm a-prepared. I can de-bone herring in thirty-eight seconds, and I can make five minute frosting in four minutes! (chuckles) Look out, Van Stomm. Chef Guilbaud is coming for you!"
3,58,Buford,Who puts tofu on lasagna?!
3,58,Guilbaud,"I was just trying to be avantguard, Che--"
3,58,Buford,"Yeah, people need to be ""ava-guarded"" from your food! (kicks plate)"
3,58,Guilbaud,"Clearly, I have much to learn. (sobbing)"
3,58,Roger,"I don't know, Katt Karr. We've been all over Metroburg, and still no sign of the sinister Professor Nibbles. Got any ideas?"
3,58,Roger,"Saucer of milk? Okay, I don't see how that's gonna help, but you're the car."
3,58,Jeremy,"Hey, Suzy. What are you doing out here, and what's with the lumpy table?"
3,58,Suzy,"Oh, uh, it's my lemonade stand."
3,58,Jeremy,Lemonade stand? Where's the lemonade?
3,58,Suzy,I... drink-ded it.
3,58,Jeremy,Holy guacamole! You sure are a handful. (He leaves)
3,58,Norm,I made more lemonade!
3,58,Suzy,About time! We just lost a customer! Now help me fix this lumpy table!
3,58,Buford,"Look, some people tend to think I'm a bit harsh with these guys. But here's how I see it. DISGUSTING! UTTER GARBAGE! RAW SEWAGE ON A PLATE! It's really all about nurturing the talent."
3,58,Roger,"We've almost caught up with Professor Nibbles, Katt Karr."
3,58,Roger,"Bad Katt Karr! Bad Katt Karr! No, No!"
3,58,Man,Poor Ducky Momo. Still can't find the bridge? Can you help him find the bridge?
3,58,Ducky Momo,(quacks)
3,58,Kids,"Behind you! It's behind you! Oh, for crying out loud, Just turn around! Rotate your body! No, not that way! Where are you going?! The bridge is right here by us! We can see it from here!"
3,58,Boy,"Boy, I'm hungry."
3,58,Girl,Me too.
3,58,Both,Hey! It's Meap!
3,58,Girl,"Meap, did you bring something fun to eat?"
3,58,Meap,Meap! Meap!
3,58,Children,"Yay, Meap's Carbonated Goulash!"
3,58,Advertiser,"That's right, kids! It's new deliciously carbonated Meap goulash, the goulash with foam! Featuring quasar pork-rolls, blackhole ham hunks, death ray beef segments, spaceship tofu, and Blue Chimpanzee DNA replicate helix marshmallow!"
3,58,Children,"Thanks, Meap!"
3,58,Girl,"Meap, your goulash is--"
3,58,Meap,Meap!
3,58,Girl,You took the words right out of my mouth!
3,58,Children,(laughing; foam comes out) It's the goulash with foam!
3,58,Advertiser,"New Meap Carbonated Goulash, includes everything you see here, except the bowl. Batteries not included."
3,58,(text,It's got that BANG!)
3,58,Meap,Meap!
3,58,Narrator,"We earn more patches before 9:00 AM, than most can in a lifetime. We dedicate our lives to be part of something greater than ourselves."
3,58,Woman,"You okay there, big guy?"
3,58,Man,No!
3,58,Narrator,"With each patch earned, a new skill beyond the ordinary. We are the few, the relentless, The Fireside Girls."
3,58,Isabella,We also have sleepovers!
3,58,Narrator,"Earn credits for middle school, so talk to your local Fireside recruiter today"
3,58,Man,"Tonight, Vance Ward's exciting escape attempt, while Bob and Junebug are sidelined after Bob tries to maul celebrity judge Sherman from the 80's band, Love Händel. Tonight on Dancing with the Bears."
3,58,Baljeet,There is nothing to worry about way out here!
3,58,Jeremy,"Well, I guess he's really gone, Suzy. You've got to admit, he was a lot of trouble. But deep down, I'm gonna miss that big guy. Come on, let's go inside."
3,58,Suzy,I'll be in in a minute.
3,58,Jeremy,Okay. (He leaves)
3,58,Suzy,"Okay he's gone, you can come out now!"
3,58,Norm,"That's great, because I've got fireworks!"
3,58,Suzy,Holy guacamole! You sure are a handful. (She winks and Norm does the same)
3,58,Guilbaud,"It wasn't to what Chef Van Stomm was saying. It was how he was saying it. So, I decided to take his teachings to heart."
3,58,Buford,And I couldn't be prouder!
3,58,Reporter,"Huge meteor to impact the Earth at 9 o'clock tonight. Also, who's this little fella, and why is he in a bookcase? We'll have this story at ten."
3,58,Roger,"Well, Nibbles, it looks like you're caught like a rat in a trap. And you'll have plenty of time to gnaw on that in the state prison. And you'll be a rat in a, you'll, well... You know what? I'm out of rat metaphors. Anyway, thanks for all your help, Katt Karr."
3,58,Roger,"Oh, let's pretend like didn't see that."
3,58,Kids,"What is he looking at?! That's not a bridge! What is that? That's a candy wrapper, not a bridge! Oh great! Look at this! Now, where's he going?! Get back here! Where did he go? Where did he go? How has he survives this long?"
3,58,Baljeet,"So, it turned out that the invasion was all just a big misunderstanding."
3,58,Girl 4,"So, does that mean we're safe now?"
3,58,Baljeet,That all depends. Do you want more carbonated goulash?
3,58,Girl 4,I don't get it.
3,58,Phineas,So! What do you think of Ferb TV?
3,58,Candace,"(pause, stands up) I'm telling Mom. (She leaves to do so)"
3,58,Phineas,I think she liked it.
3,58,Candace,"(Enters with Linda) Right here Mom, right on top of our -- (There's nothing there) taaaaa..."
3,58,Linda,"Again, what am I looking at?"
3,58,Phineas,"Oh, there you are, Perry! Holy guacamole! You sure are a handful!"
3,58,Advertiser,"Meap Carbonated Goulash pieces are closer than they appear. Meap Carbonated Goulash may be subject to license title tax, and destination charges. Please wash hands thoroughly after contact with Meap Carbonated Goulash, if hunger persists after contact with Meap Carbonated Goulash, consult your--"
3,58,Doofenshmirtz,"Oh, I'm sorry, is this Studio A?"
3,58,Advertiser,"No, this is Studio—Hey, wait a second. You just wanted to get into this episode, didn't you?"
3,58,Doofenshmirtz,What?! No...! No!
3,58,Advertiser,"Yes, you did!"
3,58,Doofenshmirtz,"Yes, I did."
3,58,Advertiser,Get out!
3,58,Doofenshmirtz,Alright. But I can totally read that faster than you.
3,58,Advertiser,Out!
3,58,Doofenshmirtz,"Okay, okay, grumpy."
3,58,Advertiser,Batteries not included.
3,58,Doofenshmirtz,Batteries not included!
3,58,Advertiser,OUT!
3,63,Doofenshmirtz,"(He laughs evilly) I got you now, Perry the Platypus! This is the most sophisticated trap that I have ever invented.(Chamber shows Agent P trapped) In fact, it's so escape-proof that- that I couldn't get that guy out."
3,63,Doofenshmirtz,"So, I had to build a whole new trap to catch you. And of course, I had to buy a new plastic skeleton for Halloween. It's a pitiful existence I lead, Perry the Platypus. Do- Do you pity me? You should because I am pitiable. Everyone should pity me. Eh, you don't have to say pity too many times before it stops sounding like a word. Pity. Pity. Pit- See? That is only like two times and it's already just gobbledygook. Gobbledygook, too. I can't- I can't even get through that once. Gobbledy- Now see, I am not even consider the last syllable and it's already... (sighs) Great. Now, I am forgetting what I was talking about... Which is another reason to pity me! YEAH! Back on topic, baby! You see, I- I figured if I get myself big sad eyes, people would pity me and get me whatever I want. And to that end, behold! The Big-Sad-Eye-inator! You like it? It sums up a lot of juice, so I am running at night when the electricity is cheaper."
3,63,Doofenshmirtz,But the nighttime is the right time for a party. A PITY PARTY! (He laughs) Here we go!
3,63,Candace,(On the phone) Don't worry about a thing Mom everything's under control.
3,63,Linda,(In the car with Lawrence) Thanks Candace. It's been too long since your father and I had a date night.
3,63,Lawrence,"Thirteen days, twenty-two hours, and seventeen minutes."
3,63,Linda,How do you know that?
3,63,Lawrence,I've got an app on my phone.
3,63,Candace,"Don't worry about us, bye. (She hangs up) Parents are weird."
3,63,Phineas,"Yes, yes they are."
3,63,Doofenshmirtz,"It takes a while to get warmed up, but we're almost there."
3,63,Doofenshmirtz,See I told you it took up a lot of juice.
3,63,Candace,What happened?
3,63,Phineas,I think we blew a fuse.
3,63,Candace,"Don't get all technical on me, just fix it."
3,63,Phineas,"Relax Candace, Ferb and I'll check the fuse box. In the mean time you go find a flashlight."
3,63,Candace,"Okay. Find a flashlight, find a flashlight."
3,63,Phineas,"Hey Ferb, isn't it cool how you can still see people's eyes in -- (doesn't see Ferb) Ferb? Where'd you go?"
3,63,Phineas,Oh-ho! You prankster.
3,63,Candace,"I know we have a flashlight in here somewhere. (begins feeling around in a drawer) Oh, okay, that's a stapler, Oh! Scissors. And, what is this, an old banana? Eww. What happened to all the flashlights? Ah-ha! (The flashlight flickers out) Darn, the batteries are dying. I better conserve them. Phineas? Ferb? (trips) Oh who leaves a chair right next to a table?"
3,63,Phineas,Looks like the whole town's in a blackout.
3,63,Buford,What'cha dooooin'?
3,63,Phineas,Isabella? Your voice sounds horrible.
3,63,Buford,"Fooled ya'! It's me, Buford! And my voice isn't horrible, it's raspy! You gotta spend hours screamin' in the closet to get it like this. Hours!"
3,63,Isabella,"Hey Phineas, what'cha dooooin'?"
3,63,Phineas,There's the original. I'm glad your here Isabella. Ferb and I are working on something that will give us all the best blackout ever!
3,63,Baljeet,Can I help?
3,63,Phineas,Sure you can Baljeet.
3,63,Buford,Hey Baljeet.
3,63,Baljeet,"Hey Buford, your voice is so raspy. It sounds as if sandpaper and a washboard had a baby."
3,63,Buford,"See, closet time's paying off."
3,63,Phineas,Okay guys let's get to work.
3,63,Candace,"Hey, hold it right there. Who else is back here? Roll call."
3,63,Phineas,"Well there's Ferb, Isabella, Buford, Baljeet and me. Oh, and there's that kid in the corner with the eyepatch."
3,63,Kid with Eyepatch,"(spookly) But is it my left eye, or my right eye? You don't know."
3,63,Candace,"(On the phone) Hi Mom, yeah we're okay. In fact I was just about to call you. I can't see what Phineas and Ferb are making but I'm sure it's bustable."
3,63,Linda,"Well, it'll have to wait. Traffic lights are out all over the city. Of course you know I'd like nothing better than to give up my special time with your father, to run home and not see what they may, or may not have done."
3,63,Lawrence,I can't remember were you always this sarcastic?
3,63,Linda,Shh.
3,63,Candace,"They're using a wench Mom. They're making something huge, and (Candace trips and loses her phone, to a mechanical buzzing)"
3,63,Buford,Candace found the wood chipper guys.
3,63,Candace,My phone!
3,63,Linda,"Oh, we got disconnected. Now who's going to grate on my nerves all night?"
3,63,Lawrence,"Oh, so you have always been this sarcastic."
3,63,Linda,"Oh that's right, it's going to be you."
3,63,Lawrence,"You betcha, Duckie."
3,63,Candace,"One way or another, I'm going to see what all you eyeballs are making back here."
3,63,Phineas,"Sure, I want everyone to see, including Perry. Hey, where's Perry?"
3,63,Doofenshmirtz,"A blackout? Oh, Perry the Platypus isn't this wonderful? Now people can't see anything but my pitiful eyes. Look at them, Perry the Platypus, don't you feel sorry for me? Don't my sad, lugubrious eyes illicit compassion and mercy? (He pauses) Your secret agent training has taught you to squint well my nemesis. But you can't fight the power of these pathetic, pleading eyes. I guess you can, 'cause you're heartless Perry the Platypus. You know that? Where you're heart should be, a big empty sack of nothing. But the common man will not be able to. I'm going to go find someone on the street and test these babies out. And you're coming with me. Here come on. It's a good thing I put wheels on this trap. Try to keep up."
3,63,Phineas,Somebody hand me that wrench.
3,63,Isabella,The power transformer is online.
3,63,Baljeet,It's a good thing you had this bicycle-powered generator.
3,63,Phineas,We like to be prepared for any eventuality. Thanks for pedaling by the way.
3,63,Baljeet,Buford was supposed to take over half an hour ago. But I cannot find him anywhere!
3,63,Buford,And you're not gonna.
3,63,Baljeet,"Buford, is that you?"
3,63,Buford,No.
3,63,Candace,"Come on you stupid thing, work! (The flashlight turns on) There. Now where is it? (sees a glimpse of mechanical arms) What the -- ? (The flashlight goes out) Ugh, stupid thing. What are you guys building?"
3,63,Candace,An anti-gravity device?
3,63,Phineas,"Nah, that's just the crane. Tighten the servomotor."
3,63,Isabella,Aye-aye.
3,63,Candace,"I'm going to fell my way through this. Okay, this feels like, metal. And this is some kind of wooden railing. Ooh, mushy-squshy."
3,63,Phineas,"We're not using any ""mushy-squshy"" stuff. But that's Perry's favorite spot."
3,63,Candace,"Okay, gross. Can you just tell me what you're building?"
3,63,Phineas,I'd love to. But it's kinda hard to put into words. You really just have to experience it.
3,63,Candace,Fine. Fire it up.
3,63,Phineas,Great. Put on this helmet. And this mouthguard. And this lead apron. Arms up... and you're ready to go.
3,63,Candace,"Okay, okay, this isn't so -- (gets flung around) BAAAAAAAAAAD!"
3,63,(Song,"""What Is This Thing?"")"
3,63,Phineas,"Wow Candace, we never thought of riding it before."
3,63,Candace,I think I swallowed the mouth-guard.
3,63,Doofenshmirtz,"Okay, Perry the Platypus, I see someone. You'll understand the power of my sad eyes when you see them in action. You ready? Watch this. Excuse me?"
3,63,Man,"Oh, you look so sad. I feel, I feel so sorry for you. What can I do? Here take this. There. And as soon as I find my home, I'll come back and give you more free stuff. You poor, poor thing."
3,63,Doofenshmirtz,You see? And I don't even know what it is.
3,63,Man 2,"Sir, your eyes, they compel me to help. Let me contribute. Here."
3,63,Doofenshmirtz,Thank you kind sir. Why is it all warm?
3,63,Woman,Your eyes bring out my mercy.
3,63,Doofenshmirtz,Don't they just?
3,63,Man 3,"Here, take all I have."
3,63,Doofenshmirtz,You gave me a wig?
3,63,Man 3,No.
3,63,Crowd,Here take this. Ooh take that. Please take this. Here have my wallet. My toaster. My watermelon.
3,63,Man 4,Oh let's all go get him some more stuff.
3,63,Man 5,Jetpack squad away!
3,63,Doofenshmirtz,"Wow, if it worked on that jetpack squad, I bet ya it'll work on my brother, Roger! He'll take pity on me, and make me mayor! And that's just a hop, skip and a jump from having people give me the whole Tri-State Area!"
3,63,Major Monogram,"(On Perry's wristwatch communicator) Thank goodness your wrist communicator is still working Agent P. We traced the blackout to the Danville power plant on 5th street. I know you're busy with Doofenshmirtz, and you don't normally handle stuff like this, but I was in the middle of microwaving a burrito, and center is still totally frozen. Just figured you were close, and uh... Hurry Agent P. it's, it's kind of scary in here, and I'm all alone.(There is a crash sound) Carl? C-Carl, is that you?"
3,63,Candace,"How can I bust you if I don't know what you've made? (A car horn sounds twice) Dad's unmistakable, two honk horn signal. They're home! Mom! Dad! You're home!."
3,63,Linda,Hi sweetie. The restaurant was closed because of the blackout.
3,63,Lawrence,What's all that noise?
3,63,Candace,"Phineas and Ferb made a dangerous...thing in the backyard, in the dark. Oh this stupid fence! Why do we have this stupid fence? Dad, tear down this fence!"
3,63,Linda,"What do you think, should we tear down this fence?"
3,63,Lawrence,That's that sarcasm I like.
3,63,Candace,You can feel what they made. Come on!
3,63,Linda,"Candace, my arm!"
3,63,Doofenshmirtz,"You, you know Perry the Platypus, I d- I didn't realize this trap would be so heavy. City Hall is still a few blocks away, you wouldn't mind if I just leave you here, do you? Hello?"
3,63,Doofenshmirtz,Where's Perry... the Platypus?
3,63,Worker 1,That's all it was? That big red switch over there?
3,63,Worker 2,You think I would've know that. I mean I got a Ph.D.
3,63,Worker 1,You work that into every conversation.
3,63,Candace,"Okay, can you feel it Mom? Can you feel it?"
3,63,Linda,I feel something...pointy.
3,63,Phineas,"You're right Ferb. (He and Ferb take off the sunglasses they were wearing) We're cooler, even in the dark."
3,63,Linda,Hi boys.
3,63,Candace,"Wait! Where is that incredibly, huge, and dangerous thing that you built?"
3,63,Phineas,A bunch of guys on jetpacks came by and asked if they could have it. So we gave it to them.
3,63,Linda,Oh you boys are so cute.
3,63,Candace,But what was it? What was it?!
3,63,Roger,So why is it that you think I'm just going to hand over my mayorship to you?
3,63,Doofenshmirtz,"Oh, because I've got these big sad eyes."
3,63,Roger,"Yeah, and they're kind of freaking me out."
3,63,Doofenshmirtz,"Yeah, I guess it probably works better in the dark. Look, it's the jetpack squad."
3,63,Man,"Here sad eyed man, we brought you this."
3,63,Doofenshmirtz,"Oh, I think I swallowed my mouth guard."
3,63,(Song,"""What Is This Thing?"")"
3,62,Candace,"(talking to Stacy on the phone) I think you're right Stacy, the ocean would be a lot deeper without all those sponges. (Candace hears noises outside) What is that noise? It is driving me crazy! Aha!"
3,62,Phineas,"Nice try Ferb, but you can't psych me out with your dead on celebrity impressions."
3,62,Candace,"All right, what is this?"
3,62,Phineas,Table tennis.
3,62,Ferb,"Ping pong, for the layman."
3,62,Candace,"Yeah, yeah, but is it like, laser-activated, nuclear powered, supersonic ping pong?"
3,62,Phineas,"No, good idea though."
3,62,Candace,"Ping pong, huh? I bet. I'll just stay right here until the inevitable weirdness happens. Any minute now. Alright, so where's Perry?"
3,62,Major Monogram,"(Through Perry's wristwatch communicator) Monogram to Agent P. Already airborne, I see. I like that! Doofenshmirtz has recently purchased an inordinate number of chairs. Hundreds of them! Far more than necessary for a person with no friends, and only one tushee. Well actually I'm, I'm just sort of assuming about the tushee. But I'm pretty confident in the no friends thing. You think it'd be the other way around, but the way he's always playing with forbidden science, you can never really be... This is coming out kinda weird, huh. Look, you're going over their anyway, just, just take a look, okay? Monogram out."
3,62,Doofenshmirtz,"Psst! Perry the Platypus, over here. Hurry, hurry, it's- the show's about to start!"
3,62,Norm,Ladies and gentlemen!
3,62,(Song,Evil Tonight (instrumental))
3,62,Norm,"Someone in our studio audience has a date with history! So come on up, because this is your backstory, Heinz Doofenshmirtz!"
3,62,Doofenshmirtz,"Me? Hahahahaha! It's me, Perry the Platypus!"
3,62,Norm,Let's give him a big round of applause!
3,62,Norm,Tonight we explore the life of a true evil genius. And find out just what makes him tick.
3,62,Doofenshmirtz,But how?
3,62,Norm,"I'm glad you asked! With the help of our exciting but potentially lethal memory extraction technology, all of your most deeply suppressed memories will appear right on this screen! It's like a TV clip show fueled by your own brain. Now let's start our trip down memory strasse on the day of your birth, in beautiful Gimmelshtump, Drusselstein!"
3,62,Doofenshmirtz,"I don't really remember much about it, I was pretty young at the time, but- ooh! Ooh-Ooh! (The tube connected to the helmet Doofenshmirtz is wearing begins to bubble) I can feel it tingling; something's coming out!"
3,62,Norm,"(Norm shows a clip from when Doofenshmirtz was born) Aww, how cute! But where's Mom?"
3,62,Doofenshmirtz,"She didn't, uh- show up for the birth."
3,62,Norm,Remember this voice?
3,62,Doctor,"When they are born, we slap their bottoms to start them breathing."
3,62,Norm,"Here he is, all the way from Gimmelshtump Memorial Hospital, Dr. Mortimer Shlussel."
3,62,Doofenshmirtz,"Dr. Shlussel, so good to—Hey!"
3,62,Dr. Shluelsle,He is breathing.
3,62,Norm,And I'm sure you can guess who this next voice belongs to...
3,62,Mrs. Doofenshmirtz,"Heinz, my little hobbengusher."
3,62,Doofenshmirtz,"Aw, when she says ""hobbengusher"" like that, it's easy to forget that it means--"
3,62,Norm,It's your mother!
3,62,Doofenshmirtz,Mama!
3,62,Mrs. Doofenshmirtz,Hobbengusher. (She whacks him on the bottom as well)
3,62,Doofenshmirtz,"Yeah, that's the way you normally say it."
3,62,Doofenshmirtz,AH! Ow! Why!? Ow! Why!? Why!?
3,62,Norm,"Yes, your relationship with your mother left something to be desired. But, what about Dad?"
3,62,Doofenshmirtz,"Well, yeah, you know, tho- those were hard times."
3,62,Mr. Doofenshmirtz,Bewegen Sie nicht! (Don't Move!)
3,62,Doofenshmirtz,"While the other children played Kick-the-Schtumpel and eat Doonkelberries, I would stand for hours."
3,62,Mr. Doofenshmirtz,Bewegen Sie nicht!
3,62,Doofenshmirtz,All through the cold night as the Spitzenhound howled.... My only companion was the moon. And my neighbor Kenny.
3,62,Mr. Doofenshmirtz,Bewegen Sie nicht!
3,62,Norm,"What a fascinating life. We'll keep track of the level of emotional pain each backstory causes, on this colorful Gnome-o-Meter! As shown by Vanna, our gnome-o-meter spokesmodel. Looks like our gnome has begun his climb! (The gnome begins to travel up the Gnome-o-Meter) Scale those heights, you bearded, Scandinavian cutie! Perform a segue back to rights of passage!"
3,62,Doofenshmirtz,"Smooth, Norm."
3,62,Norm,"Thank you, don't break the rhythm, sir."
3,62,Doofenshmirtz,"And let me tell you, transitioning to adulthood was painful, but, actually, I guess a good indicator of things to come. (in a flashback on screen) In Gimmelshtump, jumping from the high dive was an important rite of passage."
3,62,Mr. Doofenshmirtz,Are you a man or a schnitzel?!
3,62,Young Heinz,"I'm a man, I'm a man."
3,62,Queuing man,Das kind ist ein schnitzel! (That kid is a schnitzel!)
3,62,Doofenshmirtz,"After that, my father and I became increasingly distant."
3,62,Mr. Doofenshmirtz,Zu nah! (Too close!)
3,62,Doofenshmirtz,"(flashback ends) Whatever, I'm so over it. (his father walks up to him)"
3,62,Mr. Doofenshmirtz,Bewegen Sie nicht!
3,62,Norm,And there's another voice you might recognize...
3,62,Roger,What exactly am I here for again?
3,62,Doofenshmirtz,(With distain) Roger.
3,62,Norm,"It's you brother, Roger Doofenshmirtz, beloved mayor of Danville. Everybody loves him."
3,62,Doofenshmirtz,"Alright, alright, enough with the cheering; this is my show, not his!"
3,62,Roger,Can I help it if Mommy liked me best?
3,62,Norm,"Look at all those burbling memory bubbles. Tell us all about it, Dr. D!"
3,62,Doofenshmirtz,"(narrating over the clip) For a time, I was happy. It was a short time, it was... right... there. It was like five seconds when I was pushing the thing back and forth on the rug. And soon I learned my parents were expecting a brand new baby girl. My mother spent months knitting pretty dresses. Unfortunately, the baby turned out to be a boy, and because we were out of material, I was forced to wear those same dresses for an entire year! Drawing mockery and scorn from all of my manly classmates."
3,62,"(clip changes) I wanted to gain my mother's affection somehow, so I went to the claw machine district in hopes of winning her a gift. Fortunately, I had with me my allowance, which I'd been saving for a whole year","one three-cent coin. I dropped it into a slot, then carefully maneuvered the claw toward the beckoning fuzzy grail! Odds were against me, but then it happened! The miracle! The claw grabbed the stuffed animal; it was mine! Then, like a knight of yore, I gallantly gave the prize to my beloved mother... who immediately turned around and gave it to my brother, Roger. I was crushed as I watched Roger produce a big red marker and write his name on the toy. And then afterwards proceed to do the same to my mother, claiming both as his own, effectively shutting me out of the family dynamic."
3,62,Roger,"You know, Heinz, there's more than one way to a mother's heart."
3,62,Doofenshmirtz,"Kickball. My mother's love was always inexplicably linked to kick... well, I'll just let the song tell you."
3,62,(Song,"""Couldn't Kick My Way Into Her Heart"")"
3,62,Doofenshmirtz,"♪ My mother's love was always inexplicably linked to kickball, ♪"
3,62,Danny,♪ Oh yeah! ♪
3,62,Roger,"Wait a second, you had Love Händel play your flashback?"
3,62,Doofenshmirtz,I know people.
3,62,Roger,Really.
3,62,Doofenshmirtz,"...No, not really; I told them it was for you."
3,62,Roger,"Mmhmm. Well, I've got a city to govern."
3,62,Doofenshmirtz,Don't let your ego hit you on the way out!
3,62,Norm,"Although your family life was tough, your social life was. how should we say, a soul-shattering void."
