season,episode,speaker,line
4,44,Buford-2,Now this is as much fun as bustin' rocks for the state!
4,44,Major Monogram-2,We've had Doofenshmirtz moved to this interrogation room so Candace Flynn can question him thoroughly.
4,44,Carl-2,Are you sure he can't see you?
4,44,Major Monogram-2,"It's a one-way mirror. Here, watch this. (He makes a face at Doof-2.)"
4,44,Doofenshmirtz-2,"You know, I can see you!"
4,44,Major Monogram-2,"Oh, maybe it's just that he can't hear us."
4,44,Doofenshmirtz-2,"I can hear you, too!"
4,44,Major Monogram-2,Huh. Maybe I just don't know how this one-way mirror thing works.
4,44,Mover,Comin' through.
4,44,Major Monogram-2,"Oh, okay. Now I'm embarrassed."
4,44,Candace-2,"Alright, knock it off, glamour boy."
4,44,Doofenshmirtz-2,I just haven't seen a mirror for two months. Did my hair always look like this?
4,44,Candace-2,Just park your caboose in that chair.
4,44,Doofenshmirtz-2,Choo-Choo is not a caboose. It's an engine.
4,44,Candace-2,"Clam it, wise guy! You know why I'm here and you better cooperate, because there are worse things than sittin' in a cold, dank prison cell with your little choo-choo train."
4,44,Doofenshmirtz-2,Like what?
4,44,Candace-2,"Like sitting in a cold, dank prison cell without your little choo-choo train."
4,44,Doofenshmirtz-2,You wouldn't!
4,44,Candace-2,Try me.
4,44,Doofenshmirtz-2,"Alright, I'll talk."
4,44,Candace-2,"Tell me about your ex-wife, Charlene."
4,44,Doofenshmirtz-2,What do you wanna know?
4,44,Candace-2,(slams her Bo staff on the table) Where's her hideout?
4,44,Doofenshmirtz-2,"Sheesh! She's got a penthouse uptown. You can't miss it. It has ""Charlene"" written in bright lights across the top of it."
4,44,Candace-2,How do I get in?
4,44,Doofenshmirtz-2,You would have to pass through the identification scrutinizer. Only a Doofenshmirtz can get through.
4,44,Candace-2,"Lucky for us, we got one of those."
4,44,Doofenshmirtz-2,"Yeah. Oh! You mean me, right?"
4,44,Phineas-2,"Dr. Baljeet, we're back and we have Perry!"
4,44,Dr. Baljeet,That is great. And I think I figured out how to get this giant ant going again.
4,44,Phineas-2,Great! So everything's going to plan?
4,44,Doofenshmirtz-2,"(offscreen) Hey, kids! (cut to reveal Doof-2 on a dolly cuffed and facemasked) Where do you keep the silverware?"
4,44,"Isabella-2, Holly-2 and Adyson-2",(gasp)
4,44,Isabella-2,What's he doing here?!
4,44,Candace-2,At ease. He's still a prisoner. I'm just using him to get into Charlene's penthouse.
4,44,Phineas-2,"Wow, cool restraints."
4,44,Candace-2,"Actually, he asked for this stuff."
4,44,Doofenshmirtz-2,"The mask makes me sound all creepy. Here, check this out. Fava beans... Fava..."
4,44,Candace-2,"Okay, that's enough. Hey, where's Ferb?"
4,44,Phineas-2,"Oh, well, I'm sure he'd just—"
4,44,Candace-2,"Ugh! We don't have time to wait for him. We gotta get over to Charlene's. Phineas, Perry, you're with me."
4,44,Doofenshmirtz-2,Fava beans... Heh heh heh heh...
4,44,(Cut to,)
4,44,Candace-2,"(to Doof-2) Now, you, do what you have to do to get us in."
4,44,Doofenshmirtz-2,"Okay. Okay. (He puts his hand on the scanner, then his eye in the retina scanner.) Aaahhh... (A machine scans his tongue and ear.)"
4,44,Candace-2,"Wow, the identity scrutinizer is really thorough."
4,44,Doofenshmirtz-2,"You have no idea. (Ding! The doors open) Come along, people."
4,44,Vanessa-2,"Uh, Mom, Tony Marzulo asked me out to the movies. Can I go?"
4,44,Charlene-2,(getting her nails filed by a rat-borg) Didn't your father banish him?
4,44,Vanessa-2,"Yeah, but Dad banished every boy that asked me to the movies. Besides, Dad's no longer in power."
4,44,Charlene-2,"The day isn't over yet, dear."
4,44,Vanessa-2,"But, Mom..."
4,44,Charlene-2,I don't know. (to the Rat-borg) What do you think?
4,44,Rat-borg,(squeaks)
4,44,Charlene-2,There's your answer.
4,44,Vanessa-2,"Uh, thanks?"
4,44,Candace-2,"Okay, fellas. There she is. Let's get her attention. (She swipes some plates off the shelf behind her with her Bo staff and the plates shatter into pieces.)"
4,44,Charlene-2,What the heck is goin' on in there?!
4,44,Candace-2,"(bursting through the door) We got you now, Charlene! Your evil days are over!"
4,44,Charlene-2,"Oh, how sweet! Do come in and thank you for returning my husband."
4,44,Candace-2,Husband? I thought you two were divorced.
4,44,Charlene-2,"It was all a ruse, honey."
4,44,Candace-2,"Wait, you two are pretending to be divorced? Why would you do that?"
4,44,Charlene-2,"Naive child, let me explain."
4,44,(Song,All the Convoluted Reasons We Pretend to be Divorced)
4,44,Charlene-2,"♪ When a dictator gets deposed, ♪"
4,44,Doofenshmirtz-2,♪ Oy vey! ♪
4,44,Charlene-2,♪ His wife is thrown in right beside him ♪
4,44,Doofenshmirtz-2,"♪ Me and Mrs. Doofenshmirtz, ♪"
4,44,Charlene-2,♪ We told everyone around us ♪
4,44,Doofenshmirtz-2,"♪ Yes, we were through! ♪"
4,44,Charlene-2,♪ There's that and then there's also tax ♪
4,44,Doofenshmirtz-2 and Charlene-2,♪ All the convoluted reasons ♪
4,44,Charlene-2,♪ We don't agree on restaurants ♪
4,44,Doofenshmirtz-2,♪ But now for those activities ♪
4,44,Doofenshmirtz-2 and Charlene-2,"♪ We spend so little time together, ♪"
4,44,Candace-2,"Okay, I get it, you're still married. But why would you send the ants to the picnic? You had to know we'd come after you."
4,44,Charlene-2,"Of course. And I also knew you would use Heinz to get in the building, bringing my husband back to me and getting you here, so I could get the drop on you."
4,44,Candace-2,"A lot of convoluted reasons there, too."
4,44,Charlene-2,We've got another song! (The music starts up again.)
4,44,Candace-2,"No no no, we're good. (The music warps down.)"
4,44,Charlene-2,"And now, children, we have prepared a nice cozy prison cell for you. (The animal cyborgs surround them.)"
4,44,Candace-2,All the animal agents!
4,44,Charlene-2,"Wait, you haven't seen my newest one!"
4,44,Candace-2,(gasps offscreen) You villain! You turned my brother into a cyborg!
4,44,Charlene-2,"Ferb-borg, relieve Candace of her weapon. (to Peter the Pandaborg) Take them to the holding cell to await cyborg reprogramming. (they leave) Oh, it's so good to have a cyborg who can actually speak."
4,44,Ferb-2,"Well, I usually say only one line per day."
4,44,Charlene-2,"One line, really? Why?"
4,44,Ferb-2,(blinks)
4,44,Charlene-2,Seriously? That was it?
4,44,Ferb-2,(blinks)
4,44,Doofenshmirtz-2,Eh. Weird kid.
4,44,Charlene-2,"Well, Heinz, shall we retake over the Tri-State Area now?"
4,44,Doofenshmirtz-2,"Actually, I-I-I don't really wanna be an evil dictator anymore. I've got everything I need right here. (He gives Choo-Choo to Charlene-2.) My Choo-Choo, my family, this lovely penthouse, my freedom and... (Cut to outside as Choo-Choo is thrown out the window.) Choo-Choo!!! Backstory reforming... Evil returning... Aw, yeah! I'm back, baby!!!"
4,44,Candace-2,"Ugh, I'm sorry I got you into this, Phineas."
4,44,Phineas-2,"Oh, that's okay, Candace."
4,44,Candace-2,"But we're gonna have to be strong. Jail is a mental game. They're going to try to break us, you'll see. Seconds become hours, hours become years, until the mere thought of freedom flutters out of our consciousness like a dying butterfly. (The cell door opens.)"
4,44,Phineas-2,"You're right, that did seem like forever."
4,44,Candace-2,"Look! It's the Ferb-borg! Get behind me, Phineas! I'll hold him off as long as I can!"
4,44,Ferb-2,"(takes off his disguise) Please, Candace, you're being dramatic. (frees Perry-2)"
4,44,Candace-2,What? Ferb? You're not a cyborg?
4,44,Phineas-2,"Sorry we had to fool you like that, Candace, but we needed you to be convincing."
4,44,Candace-2,But why?
4,44,Phineas-2,"Ferb figured that if Doof and Charlene thought that they had the leader of the Resistance and the Platyborg under lock and key, they would devote all their attention to the frontal attack. That way, we could come up from behind and—"
4,44,Candace-2,"Wait, what frontal attack?"
4,44,Phineas-2,That one.
4,44,Dr. Baljeet,"(offscreen) That is not how to make it climb, Buford."
4,44,Buford-2,"Oh, you wanna climb the building!"
4,44,Doofenshmirtz-2,"Hey, looks like someone's comin' late to the party."
4,44,Charlene-2,"That's okay, dear. I've got a little present for our unwelcome guest. (Puts a large metal capsule on her right arm.)"
4,44,Doofenshmirtz-2,"Wow, y-you know, Charlene, you're really on top of things here. Tomorrow, I'm taking you shopping for a new evil pantsuit."
4,44,Isabella-2,"Alright, everybody! Go go go go go!"
4,44,Isabella-2,So much for our ride home.
4,44,Doofenshmirtz-2,"Wow, nice shot!"
4,44,Charlene-2,"(on a walkie-talkie) Attention, all animal cyborgs, attend to our guests!"
4,44,Dr. Baljeet,All we have to do is get these magnetic deprogramming chips near the cyborgs' frontal lobes and they will no longer be evil.
4,44,Isabella-2,How do we do that?
4,44,Buford-2,"(getting a fedora out of a bag) Look, we sewed 'em into these little hats."
4,44,Isabella-2,"Aw, that's so cute!"
4,44,Isabella-2,"Everyone, grab a hat! We've got cyborgs to reprogram!"
4,44,Doofenshmirtz-2,Now finish him off! (Charlene-2 is about to shoot but Candace-2 drops down.) Ahhh...
4,44,Candace-2,"Give it up, Charlene!"
4,44,Charlene-2,Seems to me you're still outnumbered.
4,44,Charlene-2,"Seriously, how did he ever run this place without me?"
4,44,Isabella-2,"Alright, fan out! (Isabella-2 runs up to Pinky the Chihuahuaborg.)"
4,44,Pinky the Chihuahuaborg,(growls)
4,44,Isabella-2,"Pinky, I just wanna..."
4,44,Isabella-2,"Okay, so you're not a hat guy. Take it easy."
4,44,Pinky-2,(pants happily)
4,44,Isabella-2,Pinky! (she hugs him) Good to have you back! (kisses him)
4,44,Candace-2,Surrender or there'll be big trouble.
4,44,Charlene-2,"Oh, I think I'll go with that second thing you mentioned."
4,44,Charlene-2,"End of the line, kid! What a shame! I'll make ya an offer. I could get rid of you right now or you could join me. You could be the leader of my cyborg army."
4,44,Candace-2,"(smiling) Actually, it looks like your cyborg army may have changed their minds."
4,44,Charlene-2,"Wait, what are you talking about? (Agent R-2 breaks off one of Charlene-2's fingernails.) My manicure!! (she trips over a piece of equipment) Whoa!"
4,44,Candace-2,"It's all over, Charlene. (The reformed animal agents surround her.) Now surrender."
4,44,Charlene-2,Ha! (presses a remote causing another capsule to come out of the floor) A Doofenshmirtz never surrenders! We fight until the last man!
4,44,Doofenshmirtz-2,"Hey, wait a minute! I'm the last man! D-Don't I get a say in this?"
4,44,Charlene-2,"Oh, come on, honey. It'll be fun."
4,44,Vanessa-2,"Alright, hold it! Everybody just stop! (opening the animal agents like a door) Excuse me. (to Candace-2) Can I talk to my parents? Listen, Mom, Dad, come here. You guys, I'm only gonna say this once. (breathes) RUN!!!"
4,44,Vanessa-2,"Mom, Dad, this is Tony Marzulo."
4,44,Tony,"Hey, Mr. and Mrs. D."
4,44,Doofenshmirtz-2,"Hey, didn't I banish you?"
4,44,Charlene-2,"Yeah, honey, you did, but nobody saw it."
4,44,Candace-2,"Academy graduates, Doofenshmirtz is still out there and no doubt he's planning a comeback. But so are we. We now have you, the animal agents of OWCA, who will, without a doubt, prevail. So as I step down from my position as head of the Resistance, (Monogram-2 and Carl-2 react to this in fear) I congratulate you all and wish you luck."
4,44,Major Monogram-2,"Whoa, wait! You're stepping down?"
4,44,Candace-2,"It's okay, Major. You've got your animal agents back. I think you can handle it."
4,44,Major Monogram-2,But...
4,44,Candace-2,"Don't worry. (She gives Monogram-2 her Bo staff.) If you ever get in a pinch, you know where to find me. Now if you'll excuse me, there's something I've been putting off that I need to take care of."
4,44,Major Monogram-2,Where is she going?
4,44,Isabella-2,"Unless I miss my guess, I'd say she's making room in her life for other things."
4,44,Jeremy-2,15...16...17... (Candace-2 joins him) 18... Hey!
4,44,Candace-2,"Hey, yourself."
4,44,Charlene-2,♪ We told everyone around us ♪
4,44,Doofenshmirtz-2,"♪ Yes, we were through! ♪"
4,44,Charlene-2,♪ There's that and then there's also tax ♪
4,44,Doofenshmirtz-2 and Charlene-2,♪ All the convoluted reasons ♪
4,45,Becky,"Hey, Vanessa! How was your summer?"
4,45,Vanessa,"Oh, the basic. Pretty cool when I was at my mom's and okay when I was at my dad's. Did you know in July, he actually removed all the blue from all the paintings at the museum? All the blue!"
4,45,Lacie,"Omigosh, I totally saw that! Picasso's whole Blue Period is just beige now."
4,45,Vanessa,Yep. That was my dad.
4,45,Johnny,Sigh.
4,45,Vanessa,"Hi, Johnny."
4,45,Lacie,It looks like he didn't take your breaking up very well.
4,45,Johnny,(offscreen) Sigh.
4,45,Vanessa,"It wasn't like we were going out that long, Johnny!"
4,45,Johnny,"Just take the dissection tray and use its wax foundation to cradle my broken heart, Vanessa!"
4,45,Male Student 1,"Let it go, bro."
4,45,Vanessa,And to think I wanted to come back to school for a sense of normalcy.
4,45,Principal Lang,"Good morning, people. As you know, there have been some staff changes. If you'll sit down, I will introduce you to your new science teacher..."
4,45,Doofenshmirtz,Dr. Heinz Doofenshmirtz!
4,45,Lacie,What?
4,45,(Song,Doof 101)
4,45,Danny Jacob,♪ He was the king of evil science ♪
4,45,Laura Dickinson,♪ Now he's turning over a brand new leaf ♪
4,45,Danny and Laura,♪ Now he's got a second chance ♪
4,45,Doofenshmirtz,"♪ Oh, we're gonna have a ball ♪"
4,45,"Doofenshmirtz, Danny Jacob and Laura Dickinson",♪ Doof 101! ♪
4,45,Principal Lang,Dr. Doofenshmirtz is here on a trial basis.
4,45,Doofenshmirtz,"Yeah, no, we already had the trial. The judge gave me a choice of doing hard time or community service. So, here I am, ready to impart upon these young, sponge-like minds all my vast knowledge of evil sci—I-I mean science. That's right. Regular old science. No evil at all. In fact, I've crossed out the word ""Evil"" whenever it appears in my old textbooks. So, this should be a piece of cake. (to Vanessa) Hi, sweetie-kins! (Vanessa slams her head on her desk.) Thank you, Principal Lang. I can take it from here."
4,45,Principal Lang,"Just so you know, Heinz, I've got my eye on you. I miss nothing."
4,45,Doofenshmirtz,"And nice to see you, too! (to the class) Y'know, we knew each other long ago, but that's a story for another time. I'm Dr. Doofenshmirtz. (writing on the blackboard) D-O-O-F-E..."
4,45,Vanessa,"Dad, come here. (she grabs him out of the classroom)"
4,45,Doofenshmirtz,Uh... (pops back into the frame) ...enshmirtz!
4,45,Vanessa,"Dad, what are you doing here?"
4,45,Doofenshmirtz,Isn't this great? More father-daughter time!
4,45,Vanessa,"No, not at my school! Really?"
4,45,Johnny,So you're Vanessa's dad? I'm Johnny.
4,45,Doofenshmirtz,Didn't she dump you?
4,45,Vanessa,We were hardly going out!
4,45,Johnny,"(whining) Yes, we were!"
4,45,Doofenshmirtz,"Ah, girls don't like guys who are whiny. You're whiny. I get it. I get it."
4,45,Becky,"Mr. Doofenshmirtz, if you're Vanessa's dad, is she gonna get, like, special treatment? I've taken extra booster classes in science to ensure my early acceptance—"
4,45,Vanessa,"No! No special treatment, because this is not happening!"
4,45,Lacie,(beat) What's goin' on?
4,45,Doofenshmirtz,"Everybody, back in class."
4,45,Mrs. Pierpoint,"Principal Lang, are you brooding again?"
4,45,Principal Lang,"Why does everyone always think I'm brooding? It's my brow, isn't it?"
4,45,Mrs. Pierpoint,Well...
4,45,Principal Lang,"Yes, I'm brooding! It's that Heinz Doofenshmirtz! We went to community college together."
4,45,Mrs. Pierpoint,Oh.
4,45,Principal Lang,"He wound up marrying Charlene, the girl that I was in love with!"
4,45,Mrs. Pierpoint,Aren't they divorced now?
4,45,Principal Lang,That's not the point!
4,45,Mrs. Pierpoint,"Oh, I'm sorry."
4,45,Principal Lang,How could she have preferred him to me?
4,45,Mrs. Pierpoint,"Well, maybe it's time to give up your grudge."
4,45,Principal Lang,Give up a grudge? Never! What do you think this brow is for?
4,45,Doofenshmirtz,"Let's start with genetics, the building blocks of life. Your genes determine what you will be. A...A turtle or a bird or... For instance... (plucks a hair off of Johnny)"
4,45,Johnny,Ow! Hey!
4,45,Doofenshmirtz,"Oh, don't be a baby. You've got plenty. At least for the next ten years. Let's see genetics at work, shall we? (He puts the hair in a petrie dish, and puts the dish under a microscope.) Now, all of the information that makes this young man who and what he is is stored in these DNA strands in every cell of his body. The-The genetic code is very delicate. See, now, if we move this base pair over to here, he would have been a gorilla, or you know, maybe a lizard. Y'see, there's this whole world of things going on, too small for us to even notice."
4,45,Yellow insect,"So, what are we doing here again, Napoleon?"
4,45,Napoleon,"(the purple insect) Well, Wendell, we're going to make contact with these magnificent giants!"
4,45,Wendell,We will?
4,45,Napoleon,"Yes, we will."
4,45,Wendell,Wait. Why will we?
4,45,Napoleon,"To be the first ones to communicate with a alien race. Just think, Wendell, you and I and Floyd are going to go where no bug has gone be— Okay, where's Floyd? Floyd!"
4,45,Floyd,"Sorry, sir. Ran into a spider web. Lost my wings."
4,45,Napoleon,"They're behind you, Floyd."
4,45,Floyd,"I found 'em, sir."
4,45,Napoleon,So as I was saying—
4,45,Floyd,They were behind me.
4,45,Napoleon,"Yes, we've established that. Continuing, we are going to make contact with the giants! But first, we must scale the Cliffs of Mahogany! (referring to the desk) This may take a few tries, but—"
4,45,Wendell,"Sir, let me throw it! I'm the muscle!"
4,45,Napoleon,You're the muscle?
4,45,Wendell,"Yes! You're the brains, I'm the muscle, and Floyd is..."
4,45,Napoleon,Floyd is the ballast?
4,45,Wendell,Yes! Floyd is the ballast!
4,45,Floyd,"Ooh, that sounds important."
4,45,Napoleon,"Anyway, Wendell, if you're feeling muscular, be my guest."
4,45,Wendell,"Stand back! (He swings the grappling hook, which is actually a string with a bent paper clip on it. The clip latches onto a beaker. The beaker tips off the desk and traps the bugs.)"
4,45,Napoleon,"Hmm. Well, we have a limited air supply. Floyd, stop breathing."
4,45,Doofenshmirtz,"Oh, that's unfortunate. (takes the dish off) Uh, hopefully, the DNA in the petrie dish won't combine with... (Johnny starts growing a lizard tail) Oh! Oh! No, see, it's... It's happening already."
4,45,Johnny,(looks behind him) Uh... (begins transforming and howls like a gorilla. His right arm becomes a gorilla arm.)
4,45,Doofenshmirtz,"Okay, so everyone pay attention to this. This is what I was talking about. The DNA of a human is only a few base pairs from that of a monkey. (Johnny's left arm becomes a lizard's arm.) Or... or a reptile for that matter."
4,45,Johnny,(growls and runs away)
4,45,Doofenshmirtz,See? I told you. A whiner.
4,45,Johnny,What is happening?!
4,45,Carl,"Uh, sir? I think you should take a look at this."
4,45,Major Monogram,Great googly moogly! I was afraid it might come to this.
4,45,Perry,(chatters tiredly)
4,45,Major Monogram,"Agent P, pick up! (turns over sleepily and scratches his rear) Agent P, please pick up! (Perry finally picks up) Ah! So sorry, Agent P, I... I know that this is your time to enjoy some well-deserved rest, but something's gone wrong in Doof's class, and, well, the OWCA work-release program doesn't need this kind of scandal. Whadaya say, P?"
4,45,Becky,"Guys, Johnny's running wild out there!"
4,45,Doofenshmirtz,Aha!
4,45,Vanessa,"Dad, what are you doing?"
4,45,Doofenshmirtz,"It's one of Johnny's hairs. It's loaded with his DNA. With this, I can mix up an antidote to..."
4,45,Gideon,(offscreen) He shapeshifted again!
4,45,Doofenshmirtz,"No no no. This isn't Johnny. It's, uh... (whispering) Perry the Platypus, I'm glad you're here. Could you go find Johnny and bring him back to the classroom? He's got greasy hair and he's wearing a trench coat. Mmm, and he's also part-gorilla, part-lizard. You can't miss him. (out loud) Class, Mr. Platypus is the...occasional assistant teacher."
4,45,Male Student 2,Is that a real platypus?
4,45,Doofenshmirtz,"No! It's a.... it's a man. It's a deformed, tiny...turquoise man. Vanessa, take some of your friends here, uh, uh, Ponytails, Spikey Head, Tweedle-Tie and go get Johnny."
4,45,Vanessa,"Hi, ""Mr. Platypus""."
4,45,Doofenshmirtz,"Okay, and the rest of you, Muscles, Ropey Face, Slap-Happy, Buzzy-Pants, stay here and help me with the antidote."
4,45,Ropey-Face,"Wait, why am I Ropey-Face?"
4,45,Doofenshmirtz,Take my advice: Own it.
4,45,Vanessa,"Johnny? Er, ""Creature formerly known as Johnny""?"
4,45,Johnny,(hiding under the bleachers) Go away!
4,45,Vanessa,"Johnny, you've gotta come out! My dad can help you!"
4,45,Johnny,You hate me!
4,45,Vanessa,I don't hate you. We can be friends.
4,45,Johnny,(sees Perry) Huh? Whoa! What is that thing?!
4,45,Vanessa,He's just a tiny turqouise m— AAAAH!! (Johnny carries Vanessa off like Fay Wray.)
4,45,Johnny,Vanessa!
4,45,Vanessa,Perry!!
4,45,Napoleon,"Expedition journal, entry three. We have bivouacked on a landing halfway up the cliffs."
4,45,Wendell,I don't remember bivouacking.
4,45,Floyd,I went before we left.
4,45,Napoleon,"Oy. Bivouac. It's a makeshift camp. That—Look, it's not important. What I'm worried about is, what are we going to tell the giants about ourselves?"
4,45,Wendell,Floyd throws up on his food.
4,45,Floyd,It's true. I do.
4,45,Napoleon,Let's not lead with that.
4,45,Floyd,I can also smell through my hair.
4,45,Napoleon,But what do we say to an alien species to make them understand our entire culture? Our very place in this vast cosmos?
4,45,Napoleon,What is happening?!
4,45,Floyd,I think I just bivouacked again.
4,45,Doofenshmirtz,"Careful. Careful. Everything depends on getting the mixture precise. (Becky drops the liquid into the beaker. Doof stirs it with a straw and drinks it.) Mmm. Excellent. Now that's how you make a Shirley Temple. Hey, Muscles, how's the antidote coming?"
4,45,Muscles,(wearing a hazmat suit and carrying a radioactive stick) Al...most... done. (drops it into the graduated cylinder and it explodes a bit. He pours it into the petri dish and Doof gets some of it with a needle.)
4,45,Doofenshmirtz,"Okay, we're all set. Now, where's whiny reptile boy?"
4,45,Vanessa,(offscreen) Somebody help me!
4,45,Doofenshmirtz,(offscreen) He has Vanessa! (to the rest of the class) Who's up for a field trip?
4,45,Johnny,Sanctuary!
4,45,Vanessa,"Oh, you're such a drama queen. See, this... This is why we broke up!"
4,45,Ropey-Face,"Wait, where's he going?"
4,45,Doofenshmirtz,"Alright, now, how're we gonna... Nobody has a crossbow, do they?"
4,45,Becky,"I do! (beat) What? Why, is that weird?"
4,45,Doofenshmirtz,"Oh, great! Thanks! (climbs in) Hey, you got new cup holders."
4,45,Ropey-Face,Whoa! Mr. Platypus has a cool ride!
4,45,Doofenshmirtz,"Hang on, sweetie! (to Perry) Well, I guess it's just like the old saying, ""You turn a guy into a gorilla-lizard, and he carries your daughter up a bell tower."" It never really made sense to me before, but now I guess I... (Johnny pushes a bell off and it lands on Perry with a long DONG!)"
4,45,Principal Lang,It is not one o'clock!
4,45,Sally,"Hey, guys! How's it coming? Recess is almost over!"
4,45,Phineas,Almost done!
4,45,Phineas,"(pointing) Ferb, look!"
4,45,Vanessa,"Johnny, put me down!"
4,45,Doofenshmirtz,"Hey, would you just stand still?! I can't get a clear shot!"
4,45,Phineas,Aw man! I can't wait 'til we get to high school! It looks like so much fun!
4,45,Doofenshmirtz,"Perry the Platypus, hold still! I'll get it—"
4,45,Vanessa,"Dad, do something!"
4,45,Doofenshmirtz,"Oh, yes, yes! Hold on a second! (He attempts to fire the crossbow, but he and the bell topple off of the hovercar.)"
4,45,Vanessa,Dad!!
4,45,Johnny,"Vanessa, you saved my life!"
4,45,Vanessa,"Oh, please don't read anything into this."
4,45,Johnny,There's still hope!!!
4,45,Vanessa,What did I just say?!
4,45,Doofenshmirtz,"Alright, everyone, back to class. Nothing to see here. Just a giant bell."
4,45,Principal Lang,What in the bell?
4,45,Napoleon,"We've done it! We've reached the summit! Unfurl the banner, boys, and follow me! This is it! My entire existence has been leading to this moment, so that I can say... ""Weclom Ginats!"" (realizes what the banner says) Wait, what? ""Weclom Ginats?!"""
4,45,Wendell,What does that mean?
4,45,Napoleon,"Exactly my point. What does our ""Welcome Giants"" banner actually say?"
4,45,Wendell,"Oh, yeah, sorry, we spelled it phonetically."
4,45,Napoleon,"NO YOU DIDN'T!!!! Phonetically, it spells, ""Weclom Ginats!"" Come on, guys! This is our only chance to make a good first imp—"
4,45,Doofenshmirtz,"And that, class, is DNA in action."
4,45,Principal Lang,(bursting through the door) Aha!
4,45,Doofenshmirtz,That's it for today. Class dismissed.
4,45,Doofenshmirtz,"Bye-bye, now."
4,45,Vanessa,"(walking up to her father) Dad? (sighs) So, you're my teacher now."
4,45,Doofenshmirtz,I'm your teacher now.
4,45,Vanessa,"But, we're not gonna do...all of...""this""...every day, right?"
4,45,Doofenshmirtz,"I'll try. But you know, (to the tune of the Theme song) ♪ there's 261 days 'til next summer vacation ♪, and, you know, a lot can happen. Just saying."
4,45,Napoleon,Ugh. I do believe I've fractured my exoskeleton.
4,45,Wendell,And I bivouacked!
